,Author,Authors,Title,Year,Source,Type,Cites
771,Dr Ravinder Singh,RP Singh,Diallel analysis of quantitative characters in pea.,1979,Undisclosed,Other,3
772,Dr Ravinder Singh,"RP Singh, S GP",Baking response of Punjab wheats to proteolytic supplementation,1978,Undisclosed,Other,3
773,Dr Ravinder Singh,"RP Singh, J Seth","Wheat protein, grain yield and its attributes as influenced by nitrogen through soil and foliar application [India]",1976,Indian Journal of Agricultural Sciences (India),Journal article,3
774,Dr Ravinder Singh,"KPP Nair, RP Singh",Studies on fractional application of nitrogen to hybrid maize in India,1974,Experimental Agriculture,Journal article,3
775,Dr Ravinder Singh,"R Singh, RS Tripathi",Studies on mango (Mangifera indica L.) varieties. IV. Morphological and physico-chemical studies of some important table varieties.,1974,Undisclosed,Other,3
776,Dr Ravinder Singh,"RP Singh, RBL Bhardwaj",Effect of times of nitrogen application on phosphorus uptake by upland rice.,1973,Undisclosed,Other,3
777,Dr Ravinder Singh,"RP Singh, M Parshad, SK Kaushik",Effect of different levels of nitrogen and phosphorus on the yield of barley.,1971,Undisclosed,Other,3
778,Dr Ravinder Singh,"G Lal, RP Singh",Effects of sowing time and nitrogen levels on the seed yield of bhindi (Abelmoschus esculentus Moench).,1969,Undisclosed,Other,3
779,Dr Ravinder Singh,"ASG Mazumdar, KPR Pisharody, RN Singh",Kinetics of reaction between plutonium (III) and chlorine in chloride solutions,1962,Journal of Inorganic and Nuclear Chemistry,Journal article,3
780,Dr Ravinder Singh,"RP Singh, NR Banerjee",Titrimetric Determination of Copper Using Diphenylthiovioluric Acid,1960,Current Science,Journal article,3
781,Dr Ravinder Singh,RP Singh,"Ajay Pande, 1990, A decade of water balance studies with special reference to paddy crop at Agro meteorological observatory Kuthulia (Rewa) in Madhya Pradesh, India during …",Unknown,Indian J. Dryland Agric. Res,Other,3
782,Dr Ravinder Singh,"R Singh, V Singh, P Kumari, N Aggarwal, M Oberoi, H Khan, TG Singh",Evolutionary unmasking resuscitative therapeutics potential of centhaquin citrate in hypovolemic shock,2024,CNS &Neurological Disorders-Drug Targets-CNS &Neurological Disorders) 23 …,Other,2
783,Dr Ravinder Singh,"A Danodia, NR Patel, VK Sehgal, RP Singh",Surface energy fluxes and energy balance closure using large aperture scintillometer-based ET station on heterogeneous agricultural landscape in North India.,2024,Journal of Agrometeorology,Journal article,2
784,Dr Ravinder Singh,"S Khan, R Singh, H Kaur, A Kumar, A Vashishth, M Shahwan, HS Tuli",Plant growth regulator-mediated response under abiotic stress: A review,2024,Undisclosed,Other,2
785,Dr Ravinder Singh,"KR Ramya, R Gupta, M Mishra, A Pandey, K Tripathi, KC Bhatt, R Singh",A modified DNA isolation protocol for high-quality DNA and long-term storability in grasspea (Lathyrus sativus L.),2023,Indian Journal of Genetics and Plant Breeding,Journal article,2
786,Dr Ravinder Singh,"SS Rahman, P Suneja, R Yadav, Z Hussain, R Singh, SK Yadav, JC Rana, ...","Developing an NIRS Prediction Model for Oil, Protein",2023,Amino Acids and Fatty Acids in Amaranth and Buckwheat. Agriculture,Journal article,2
787,Dr Ravinder Singh,"T Bhalla, AS Nar, RP Singh, R Jindal, A Bhalla, A Mishra","Clinical Diagnosis, Management and Microbiological Profiling of Necrotizing Soft Tissue Infections–A Prospective Study of North India Region",2022,Chirurgia,Journal article,2
788,Dr Ravinder Singh,"SP Maurya, R Singh, S Sinha, H Gautam, BK Das",A study on HIV-infected individuals who reported CD4+ cell count below 100 cells/μl multiple times after more than 6 months of antiretroviral therapy at the apex tertiary …,2022,Indian Journal of Sexually Transmitted Diseases and AIDS,Journal article,2
789,Dr Ravinder Singh,"V Karuna, V Vivek, R Singh, P Gupta, N Verma",MSRSGC: a prospective study of heterogenous group atypia of undetermined significance,2022,Indian Journal of Pathology and Microbiology,Journal article,2
790,Dr Ravinder Singh,"A Kumar, KK Rajak, AK Yadav, V Rai, M Bhatt, RP Singh, RK Singh","Collection of Samples, Their Preservation and Transportation",2022,Protocols for the Diagnosis of Pig Viral Diseases,Book chapter,2
791,Dr Ravinder Singh,"BP Singh, RP Singh",Cropping and groundwater situation in a canal command area-a case study,2022,Undisclosed,Other,2
792,Dr Ravinder Singh,"H KAUR, R SINGH, K SINGH, S KAUR, M JAIRATH, SK SIDHU","Pervasiveness and Epidemiological Profile of SARS-CoV-2 Infection among the Population of Majha Region of Punjab, India.",2021,Journal of Clinical &Diagnostic Research,Journal article,2
793,Dr Ravinder Singh,"CS Azad, P Rautela, S Gupta, RP Singh",Major Diseases of Chili and Their Management,2020,Diseases of Fruits and Vegetable Crops,Book chapter,2
794,Dr Ravinder Singh,"M Kumar, RK Doharey, DK Singh, RP Singh",Knowledge of the mango growers about management practices mango growers of western Uttar Pradesh,2020,Indian Journal of Extension Education,Journal article,2
795,Dr Ravinder Singh,"SP Singh, RP Singh, AK Tiwari","Effect of dhanzyme granules on growth, yield and quality of sugarcane",2020,Plant Research and Educational Promotion Society,Journal article,2
796,Dr Ravinder Singh,"R Thakur, A Sharma, RP Singh",Design of Portable Waste Shredder Machine for Domestic Compost,2020,"International Journal of Research in Engineering, Science and Management 3 …",Journal article,2
797,Dr Ravinder Singh,"DR Baba, PM Junaid, F Khan, R Singh",Nitric Oxide Scavenging Activity of Bioactive Compounds Present in Methanolic Extract of Morchella esculenta,2018,International Journal of Scientific Research in Biological Sciences,Journal article,2
798,Dr Ravinder Singh,"KB Kataviya, B Parmar, R Patel, PJ Das, V Kumar, A Mahajan, R Singh, ...",Improvising livestock service in hilly regions through indigenous wisdom towards control of tick infestation: Institutional relationships,2018,Veterinary world,Journal article,2
799,Dr Ravinder Singh,"SM Feroze, SE Dkhar, R Singh, P Marboh, PMN Rani, KJ Singh","Impact of climate variability on farming: What the farmers of Meghalaya perceive? In (ed) Mawlong, BL, Climate change and developing countries",2018,"Cambridge Scholars Publishing, UK. pp",Book chapter,2
800,Dr Ravinder Singh,"D Ray, AD Shukla, S Bhattacharya, R Singh, T Nirmal Kumar","Serpentinite from Nidar ophiolite complex of Ladakh, India: implications for aqueous alteration to early Mars",2017,48th Annual Lunar and Planetary Science Conference,Conference paper,2
801,Dr Ravinder Singh,"CS Azad, RP Singh, A Kumar",Evaluation of Fungicides on management of dieback and fruit Rot disease dausing Alternaria tenuissima (Kunze ex Pers.) WILTSHIRE of Chilli,2017,Journal of Pharmacognosy and Phytochemistry,Journal article,2
802,Dr Ravinder Singh,"P Rautela, RP Singh",Evaluation of fungicides against Gray mould,2017,Botrytis cinerea,Book chapter,2
803,Dr Ravinder Singh,"GS Sandhu, R Singh, I Singh, F Khan",Effect of Chromium Content Variation on Wear Resistance of Rotavator Blades,2017,Int. Res. J. Eng. Technol,Journal article,2
804,Dr Ravinder Singh,"I Singh, R Singh, GS Sandhu, F Khan",Tensile Strength and Microhardness Behavior of Friction Stir Welded Joints of Magnesium AZ31B-O Alloy,2017,International Journal of Engineering and Management Research (IJEMR) 7 (2 …,Journal article,2
805,Dr Ravinder Singh,"B Mishra, RP Singh",Efficacy of fertilizers and biorationals against the fungal pathogen Stemphylium vesicarium causing foliar blight of onion,2017,International Journal of Current Microbiology Applications Science 6 (9 …,Journal article,2
806,Dr Ravinder Singh,"M Rapotra, R Singh",Anomalous formation of the portal vein and its clinical relevance: a case report,2016,International Journal of Innovative Research and Advanced Studies,Journal article,2
807,Dr Ravinder Singh,"V Singh, ND Pandey, RP Singh",Evaluation of Dynamic Performance in Terms of Effluent COD and Biomass Concentrations of UASB Reactor Treating Low Strength Wastewater,2016,International Journal of Applied Science-Research and Review,Journal article,2
808,Dr Ravinder Singh,"S Sheikh, R Singh, D Gupta, I Kaur",Pleomorphic adenoma of parotid gland-A case report.,2015,International Dental Journal of Students' Research,Journal article,2
809,Dr Ravinder Singh,"R Singh, M Bordeaux, R Fasan","ACS Catal. 2014, 4, 546; b) R",2015,"Singh, JN Kolev, PA Sutera, R. Fasan, ACS Catal",Journal article,2
810,Dr Ravinder Singh,"B Bhavya, R Singh, T Bhaskar",Preparation of feedstocks for gasification for synthetic liquid fuel production,2015,Gasification for Synthetic Fuel Production,Book chapter,2
811,Dr Ravinder Singh,"M Manchanda, E Roeb, M Roderfield, SD Gupta, P Das, R Singh, ...",P0109: elevation of cathepsin L and B expression in liver fibrosis: a study in mice models and patients,2015,"Journal of Hepatology, S341-S",Journal article,2
812,Dr Ravinder Singh,"AK Singh, N Rai, RK Singh, S Singh, RP Singh",Evaluation of combiners for resistance to early blight disease using interspecific crosses in tomato (Solanum lycopersicum),2014,Current Horticulture,Journal article,2
813,Dr Ravinder Singh,"KS Matharu, R Singh",response of Helicoverpa armigera (Hübner)(Lepidoptera: Noctuidae) larvae on different genetically engineered cotton hybrids,2012,Journal of Entomological Research,Journal article,2
814,Dr Ravinder Singh,"R Singh, RK Pande","Morphometry of landslides in Garhwal Himalaya, India",2011,Disaster Prevention and Management: An International Journal,Journal article,2
815,Dr Ravinder Singh,"R Singh, K Singh, V Kumar",Response due to mechanical and thermal sources in micropolar generalized thermoelastic medium,2011,International Journal of Applied Mechanics andEngineering,Journal article,2
816,Dr Ravinder Singh,"S Srivastava, DP Ray, RP Singh",Antifeedant Activity of Essential Oil and Carbazole Derivatives and of Murraya koenigii (L) Spreng Leaves against Spodoptera litura (Fab.),2011,Pesticide Research Journal,Journal article,2
817,Dr Ravinder Singh,"N Singh, R Singh, SK Thind, P Singh",Sampling kinnow orchards in Punjab to estimate populations of antagonistic microflora and its screening against Phytophthora parasitica causing foot rot in citrus,2011,Plant Disease Research,Journal article,2
818,Dr Ravinder Singh,"RP Singh, CR Singh, HC Mishra, D Singh, DV Singh, S Singh",Synthesis and fungitoxicity of 1-[N-benzoyl-3-(2'-substituted-3'-sulphonyl-5'-methoxyindol-3'-yl)-2-pyrazolines and 1-(N-phenylsulphonyl)-3-(2'-substituted-3'-sulphonyl)-5 …,2007,INDIAN JOURNAL OF HETEROCYCLIC CHEMISTRY,Journal article,2
819,Dr Ravinder Singh,"RP Singh, T Singh, JP Singh, VK Yadav",Effect of biotic inputs and intercropping on the performance of rainfed chickpea (Cicer arietinum L.).,2006,Undisclosed,Other,2
820,Dr Ravinder Singh,RP Singh,Impact of wetting on the performance of HV insulators under polluted conditions,2006,International Journal of Power and Energy Systems,Journal article,2
821,Dr Ravinder Singh,"BK Agarwal, AK Sarkar, RP Singh, SS Surendra Singh, J Prasad",Compacted rock phosphate as P source for soybean in an acid soil.,2006,Undisclosed,Other,2
822,Dr Ravinder Singh,"S Pandey, R Singh","The Reproductive behaviour of Lipolexis scutellaris Mack.(Hym.: Braconidae), A parasitoid of Aphis gossypii Glover (Hom.: Aphididae): adjustment of sex ratio in response to …",2005,JOURNAL OF ADVANCED ZOOLOGY,Journal article,2
823,Dr Ravinder Singh,"R Singh, K Kannan, DK Kundu, S Roy Chowdhury","Effect of paddy straw mulch on hydrothermal state, nutrient availability, growth and tuber yield of sweet potato (Ipomoea batatas L.)",2004,Advances in horticultural science [rivista dell'ortofloroftutticoltura …,Other,2
824,Dr Ravinder Singh,"CS Mitsiades, N Mitsiades, CJ McMullan, V Poulaki, R Shringarpure, ...","Insulin-like growth factor-1 receptor (IGF-IR/CD221): A target for monoclonal antibody-based therapy to overcome drug resistance in multiple myeloma (MM), other hematologic …",2003,"Blood 102 (11), 20A-21A",Other,2
825,Dr Ravinder Singh,"SN Mendhe, RP Singh, SS Mendhe","Effect of sowing time, phosphorus and potash on straw production and harvest index in Stylosanthes hamata (L.).",2003,Undisclosed,Other,2
826,Dr Ravinder Singh,"RP Singh, A Sarkar, BA Anderson",Heat transfer in air impingement systems: Design considerations,2002,"Annual IFT Meeting, Anaheim, CA, June",Conference paper,2
827,Dr Ravinder Singh,"S Kumar, RP Singh, SK Singh, A Singh",Study of genetic parameters of broiler sire line,2002,Indian Journal of Poultry Science,Journal article,2
828,Dr Ravinder Singh,RP Singh,"Study of resource use efficiency in maize and ragi production in plateau region, Bihar",2001,Economic Affairs (Calcutta),Journal article,2
829,Dr Ravinder Singh,"SS Prasad, US Yadav, RPN Singh, VK Upadhyaya, BP Pandey",Performance of advanced jute cultivars against jute pests in eastern Uttar Pradesh.,2001,Undisclosed,Other,2
830,Dr Ravinder Singh,"JP Singh, HI Hussain, AK Sharma, RP Singh, RK Singh",Reasons for technological gap of paddy cultivation in respect of soil-technology among small and marginal farmers.,2000,Undisclosed,Other,2
831,Dr Ravinder Singh,"K Srinivasulu, RP Singh, K Madhavi",Economics of pigeonpea (Cajanus cajan L.) based intercropping systems under varied planting patterns in dry lands of eastern U. P.,2000,Undisclosed,Other,2
832,Dr Ravinder Singh,"GG Rao, R Singh, GP Bhargava","VEGETATION TYPES IN BHAL AREA, MAHI RIGHT BANK AND UKAI... KAKRAPAR COMMANDS OF GUJARAT",1997,CSSRI Technical Bulletin,Journal article,2
833,Dr Ravinder Singh,"AK Tiwari, RP Singh, BS Nagai",Dot enzyme linked immunosorbent assay (dot ELISA) for detection of goat pox antigen and antibody.,1996,Undisclosed,Other,2
834,Dr Ravinder Singh,"DK Singh, RP Singh","Effect of 2,4-D on seed yield and quality characters of tomato (Lycopersicon esculentum. Mill).",1996,Undisclosed,Other,2
835,Dr Ravinder Singh,"KP Singh, R Singh, GR Singh",Chronic pathological conditions encountered in captive wild mammals,1994,The Indian Journal of Animal Sciences,Journal article,2
836,Dr Ravinder Singh,"A Chaturvedi, VC Agarwal, RP Singh",Regeneration of Used Lubricating Oils,1994,JOURNAL OF SCIENTIFIC &INDUSTRIAL RESEARCH,Journal article,2
837,Dr Ravinder Singh,"AN Singh, RP Singh",Quality characters of wheat (Triticum aestivum) grain as influenced by sources of phosphorus and their time and mode of application.,1994,Undisclosed,Other,2
838,Dr Ravinder Singh,"RP Singh, VD Tiwari, SP Chattopadhyay",Comparative study of short term results in two multidrug regimens in multibacillary leprosy.,1993,Indian journal of leprosy,Journal article,2
839,Dr Ravinder Singh,"NK Sangwan, SS Samar Singh, DP Dharam Pal, RP Singh, JC Tamak",Effect of tank mixture of tralkoxydim or isoproturon with tribenuron on weed control in wheat.,1993,Undisclosed,Other,2
840,Dr Ravinder Singh,"RL Narang, KR Gupta, APS Narang, R Singh",Plasma cobalt and manganese in depression,1992,Trace elements in medicine,Journal article,2
841,Dr Ravinder Singh,"VK Singh, BD Singh, JP Shahi, RP Singh",Estimates of genetic variances in a population of maize.,1989,Undisclosed,Other,2
842,Dr Ravinder Singh,RP Singh,Size and shape of plots and blocks for field trials on cabbage (Brassica oleracea var. capitata),1989,Indian Journal of Horticulture,Journal article,2
843,Dr Ravinder Singh,"BN Singh, R Singh, SL Durbey, AK Singh","Studies on stemborers in deepwater rice in Bihar, India",1988,Undisclosed,Other,2
844,Dr Ravinder Singh,"RP Singh, SL Singh",Photoelectrochemical solar cells using vacuum‐evaporated zinc phosphide films,1987,physica status solidi (a),Journal article,2
845,Dr Ravinder Singh,"RP Singh, NK Singh","Input-output relationship for the milch cattle in Rohtas District, Bihar.",1987,Undisclosed,Other,2
846,Dr Ravinder Singh,RP Singh,Mental health problems of absenteeism.,1987,Indian Journal of Applied Psychology,Journal article,2
847,Dr Ravinder Singh,R Singh,"Effect of temperature, sustenance and mating on rice armyworm reproduction.",1987,Undisclosed,Other,2
848,Dr Ravinder Singh,"R Bawa, R Singh",Heritage conservation of natural protected area: A case study of Lahul and Spiti,1987,Environmental Education for Conservation and Development,Other,2
849,Dr Ravinder Singh,"BK Singh, RP Singh, RB Thakur",Efficiency of different urea-materials in lowland rice and their residual effect on succeeding wheat crop in calcareous soil.,1986,Undisclosed,Other,2
850,Dr Ravinder Singh,"DK Singh, R Singh, LB Singh, CSP Singh, HR Mishra",Effect of age and breed of bucks on reproductive traits of Black Bengal does.,1985,Undisclosed,Other,2
851,Dr Ravinder Singh,"PN Singh, RP Singh, RS Ranvir Singh",Seasonal changes in vegetative growth of two cultivars of lemon (Citrus limon Burm.) in relation to weather parameters and soil temp.,1985,Undisclosed,Other,2
852,Dr Ravinder Singh,RP Singh,Economic Evalutation of Dairy Financing by Gramin Bank (Bihar).,1985,NDRI,Other,2
853,Dr Ravinder Singh,"BK Singh, RB Thakur, RP Singh",Ratooning ability of some summer rices on saline-calcareous soil.,1984,Undisclosed,Other,2
854,Dr Ravinder Singh,"RP Singh, T Lal",Propagation time of microwave signals for some Indian rock samples,1983,Gerlands Beiträge zur Geophysik,Journal article,2
855,Dr Ravinder Singh,"RP Singh, RK Singh",Weed control in upland rice as affected by weed control treatments,1983,Undisclosed,Other,2
856,Dr Ravinder Singh,RP Singh,Note on performance characteristics analysis of cattle in rural area.,1982,Undisclosed,Other,2
857,Dr Ravinder Singh,"RP Singh, J Kumar, DS Balaine, RK Sharma, SP Pruthi",Evaluation of some egg laying commercial stocks.,1981,Undisclosed,Other,2
858,Dr Ravinder Singh,"H Singh, PN Bhat, R Singh",Gene differentiation in Indian [dairy] cattle,1981,Indian Journal of Animal Sciences (India),Journal article,2
859,Dr Ravinder Singh,"AK Singh, RP Singh",COMPLEXES OF COBALT (III) WITH VIOLURIC AND THIOVIOLURIC ACIDS-SYNTHESIS AND CHARACTERIZATION,1979,JOURNAL OF THE INDIAN CHEMICAL SOCIETY,Journal article,2
860,Dr Ravinder Singh,"KPP Nair, RP Singh",Plant density studies in maize in India,1976,The Journal of Agricultural Science,Journal article,2
861,Dr Ravinder Singh,"RP Singh, M Parshad",Fertilizer use in rainfed crops-grain yield and nitrogen uptake.,1975,Undisclosed,Other,2
862,Dr Ravinder Singh,"RP Singh, SK Talapatra",Studies on growth and egg production in White Leghorn birds maintained on varying levels of protein in the mash.,1974,Undisclosed,Other,2
863,Dr Ravinder Singh,"N Misra, M Jaiswal, R Singh, B Das",INTRAHEPATIC ARTERIAL INFUSION WITH COMBINATION OF MITOMYCIN-C (MMC) AND 5-FLUOROURACIL (5FU) FOR TREATMENT OF PRIMARY AND METASTATIC CARCINOMA OF LIVER,1974,PROCEEDINGS OF THE AMERICAN ASSOCIATION FOR CANCER RESEARCH 15 (MAR),Conference paper,2
864,Dr Ravinder Singh,"RS Chawla, RP Singh",Determination of stability constants of some bivalent metal complexes with thiovioluric and diphenylthiovioluric acids,1973,Microchemical Journal,Journal article,2
865,Dr Ravinder Singh,RP Singh,Effect of micronutrients on the performance of sugarcane under Tarai conditions of UP,1973,Undisclosed,Other,2
866,Dr Ravinder Singh,"RP Singh, P SINGH, KN RAI","Acreage Response to Rainfall, New Farm Technology and Price in Haryana",1973,INDIAN JOURNAL OF ECONOMICS,Journal article,2
867,Dr Ravinder Singh,"SP Singh, RP Singh, SRP Giri",Effect of soil moisture on water use by Berseem (Trifolium alexandrium J.),1973,Indian J. Agron,Journal article,2
868,Dr Ravinder Singh,"KN Singh, RP Singh, M Parshad, AS Warsi, HS Sandhu, OP Awasthi, ...",Effect of methods and rates of nitrogen application on the grain yield of rainfed barley.,1972,Undisclosed,Other,2
869,Dr Ravinder Singh,"R Singh, SN Singh",Effects of different plant spacings and nitrogen fertilization on the agronomic characters and yield of finger millet (Eleusine coracana (L.) Gaertn.,1971,Undisclosed,Other,2
870,Dr Ravinder Singh,"BD Sharma, RP Singh",Thrombosis of mesenteric artery.(Case report),1966,The Indian practitioner,Journal article,2
871,Dr Ravinder Singh,RP Singh,A study of breeding season in buffaloes maintained at military farms.,1966,Undisclosed,Other,2
872,Dr Ravinder Singh,RP Singh,A study on the breeding efficiency of buffaloes maintained at military farms.,1966,Undisclosed,Other,2
873,Dr Ravinder Singh,"RP Singh, M Singh, YS Rao, SN Singh","Quantitative relations among the milk constituents. 1. Effect of breed, stage of lactation and age of animals.",1961,Undisclosed,Other,2
874,Dr Ravinder Singh,"R Singh, J Singh, G Khanna",Effects of coconut water ingestion on cycling performan~ ce in heat and humidity,Unknown,Undisclosed,Other,2
875,Dr Ravinder Singh,"TP Rathour, RP Singh, NK Devaraju, D Lal",of the Book: Leafy and Minor Vegetables: An inclusive study,2024,Reviews in Biotechnology,Journal article,1
876,Dr Ravinder Singh,"P Yadav, N Yadav, A Sethi, J Sarkar, RP Singh, S Srivastava",Synthesis of Pregnane–Cholesterol and Cholesterol–Cholesterol Prodrugs via Ring A–Ring A Connection. Potential Cytotoxic Activity against Cervical Cancer Cell Line HeLa,2023,Russian Journal of Organic Chemistry,Journal article,1
877,Dr Ravinder Singh,"S Pokhariyal, NR Patel, A Danodia, RP Singh",Heat wave characterization and its impact on carbon and water vapour fluxes over sugarcane-based agroecosystem,2023,Journal of Agrometeorology,Journal article,1
878,Dr Ravinder Singh,"R Singh, G Singh, N George, G Singh, S Gupta, H Singh, G Kaur, J Singh","Copper-Based Metal–Organic Frameworks (MOFs) as an Emerging Catalytic Framework for Click Chemistry. Catalysts 2023, 13, 130",2023,Undisclosed,Other,1
879,Dr Ravinder Singh,"AK Kesharwani, RP Singh, A Kulshreshtha, A Khrisna","ESSENTIAL OILS COMPOSITION OF CYMBOPOGON MARTINII GROWN IN SEMI-ARID REGION OF UTTAR PRADESH, INDIA",2023,Scientist.,Journal article,1
880,Dr Ravinder Singh,"R Singh, T Sekhon, S Sekhon, M Kumar, A Nirola, RS Gambhir",Assessment of dental professionals’ maintenance of management practices developed and incorporated during COVID-19 pandemic–a cross-sectional study,2023,Roczniki Państwowego Zakładu Higieny,Journal article,1
881,Dr Ravinder Singh,"H Gambhir, K Aditya, RP Singh, S Singla, R Isaac, S Goyal",Accuracy of ultrasound imaging findings in diagnosis of adnexal masses: a cross-sectional study,2023,Int J Anat Radiol Surg,Other,1
882,Dr Ravinder Singh,"V Kumar, R Sharma, J Kumar, RP Singh, A Kumar",Investigation of micro-cracks of pure titanium using wire electric discharge machining (WEDM) through response surface methodology,2022,Recent Trends in Materials: Select Proceedings of ICTMIM,Conference paper,1
883,Dr Ravinder Singh,"A Gehlot, R Singh, A Joshi",Retracted: Online based Viva Voce Control System,2022,2022 IEEE 3rd Global Conference for Advancement in Technology (GCAT),Conference paper,1
884,Dr Ravinder Singh,"S Kumar, NC Ghosh, V Kumar, RK Saini, R Singh, A Chaudhary, ...","Assessment of Groundwater Quality with Special Reference to Arsenic in Ballia District, Uttar Pradesh, India",2022,"Groundwater and Water Quality: Hydraulics, Water Resources and Coastal …",Other,1
885,Dr Ravinder Singh,"R Punia, C Singh, RP Singh, M Singh",Physicochemical Properties of Silibinin-Phosphatidylcholine Complex and its Implications for Drug Formulations.,2022,Indian Journal of Pharmaceutical Sciences,Journal article,1
886,Dr Ravinder Singh,"KK Rajak, Kiran, A Fayaz, V Rai, M Karki, C Einstein, M Bhatt, A Kumar, ...",An Overview of Mouse Monoclonal Antibody Production,2022,Protocols for the Diagnosis of Pig Viral Diseases,Book chapter,1
887,Dr Ravinder Singh,"B Jagadeesh, SK Maurya, RP Singh, JN Srivastava",Diseases and Disorders of Green Pea (Pisum Sativum Var. Hortense) and Their Management,2022,Diseases of Horticultural Crops: Diagnosis and Management,Book chapter,1
888,Dr Ravinder Singh,"N Mehmi, S Bhagat, N Kaur, R Singh",A clinicopathological study of squamous cell carcinoma of oral cavity and oropharynx in non-smoker and non-drinker patients,2022,Int J Otorhinolaryngol Head Neck Surg,Journal article,1
889,Dr Ravinder Singh,"SP Mishra, RP Singh",Gibbs free energy change in aqueous dissociation of benzoic acid at temperature ‘K’: A thermodynamic study,2022,Chem. Sci. Int. J,Journal article,1
890,Dr Ravinder Singh,"P Kumari, R Babbar, R Singh, B Saini",Identification and characterization of degradation products of nateglinide,2022,International Journal of Health Sciences,Journal article,1
891,Dr Ravinder Singh,"M Ranjithkumar, S Dey, M Saini, R Singh, M Saravanan, MU Sivakumar",Estimation of myelin basic protein levels in natural cases of canine distemper encephalomyelitis,2022,Indian Journal of Animal Research,Journal article,1
892,Dr Ravinder Singh,"V Khandelwal, V Bhatia, V Dogra, S Sharma, V Chhabra, R Singh, ...",3-D Printer Robot for Civil Construction: A Bond Graph Approach,2021,2021 8th International Conference on Signal Processing and Integrated …,Conference paper,1
893,Dr Ravinder Singh,"OK Yulizal, R Singh, H Salim, H Million",Effect of Snakehead Fish Extract (Channa Striata) and Metformin on Glycemic Control of Rats with Diabetes Mellitus Model,2021,Jurnal Ilmiah Kesehatan Sandi Husada,Journal article,1
894,Dr Ravinder Singh,"SP Singh, RP Singh, AK Tiwari, J Singh","Effect of Plant Growth Regulators on Germination, Yield, and Quality of Sugarcane",2021,Plant Research and Educational Promotion Society in Association with SRKSS …,Other,1
895,Dr Ravinder Singh,"N Mishra, S Sharma, A Dobhal, S Kumar, H Chawla, S Singh, R Singh, ...",Plasma neutralizing antibodies in an infant with interclade HIV-1 superinfection preferentially neutralize superinfecting HIV-1 strains,2020,"bioRxiv, 2020.12. 10.",Preprint,1
