,Author,Authors,Title,Year,Source,Type,Cites
391,Dr Ravinder Singh,"J Heier, R Singh, C Wykoff, N Steinle, D Boyer, J Monés, G Staurenghi, ...",Efficacy of intravitreal pegcetacoplan in geographic atrophy: 24-month results from the phase 3 OAKS and DERBY trials,2022,Retina Society,Book chapter,16
392,Dr Ravinder Singh,"S Sheoran, S Jaiswal, N Raghav, R Sharma, Sabhyata, A Gaur, J Jaisri, ...",Genome-wide association study and post-genome-wide association study analysis for spike fertility and yield related traits in bread wheat,2022,Frontiers in Plant Science,Journal article,16
393,Dr Ravinder Singh,"BS Mahapatra, I Bhupenchandra, SH Devi, A Kumar, SK Chongtham, ...",Aerobic Rice and its significant perspective for sustainable crop production,2021,Indian Journal of Agronomy,Journal article,16
394,Dr Ravinder Singh,"SK Verma, RP Singh, RK Singh",Effect of application time on efficiency of herbicides in wheat (Triticum aestivum L.) under zero-tillage,2007,Indian Journal of Weed Science 39 (3and4),Journal article,16
395,Dr Ravinder Singh,"SK Singh, SC Varma, RP Singh","Effect of integrated nutrient supply on growth, yield, nutrient uptake, economics and soil fertility in irrigated rice",2001,Oryza 38 (1/2),Book chapter,16
396,Dr Ravinder Singh,"TP Singh, RP Singh",Effect of rates and methods of nitrogen application on biomass and tuber production of potato.,1994,Undisclosed,Other,16
397,Dr Ravinder Singh,"G Mehrotra, RP Singh, A Krishna, BK Singh",Pyogenic liver abscess causing acute Budd-Chiari syndrome,1992,Annals of tropical paediatrics,Journal article,16
398,Dr Ravinder Singh,"R Singh, RAY SP, R CS",SOME TESTS ON REINFORCED CONCRETE DEEP BEAMS WITH AND WITHOUT OPENING IN THE WELS,1980,Undisclosed,Other,16
399,Dr Ravinder Singh,"V Singh, R Shri, P Sood, M Singh, TG Singh, R Singh, A Kumar, ...","5, 7-dihydroxy-3′, 4′, 5′-trimethoxyflavone mitigates lead induced neurotoxicity in rats via its chelating, antioxidant, anti-inflammatory and monoaminergic properties",2024,Food and Chemical Toxicology,Journal article,15
400,Dr Ravinder Singh,"N Bhadauria, SRK Dubey, P Mittal, AK Arya, RP Singh",Clinico-etiological pattern of lower gastrointestinal bleeding in children (5-18 years age group) at a tertiary care center in central India,2016,Indian Journal of Child Health,Journal article,15
401,Dr Ravinder Singh,"D Kumar, R Singh, A Kumar, N Sharma",An adaptive method of PCA for minimization of classification error using Naïve Bayes classifier,2015,Procedia Computer Science,Journal article,15
402,Dr Ravinder Singh,"PK Mukherjee, RP Singh",Efficacy of low doses of herbicides on divergent weed flora in transplanted rice,2004,Oryza,Journal article,15
403,Dr Ravinder Singh,"P Das, SK Das, HPS Arya, RP Singh, A Mishra",Inventory of Indigenous Technical Knowledge in Agriculture-Document 2,2003,ICAR New Delhi,Journal article,15
404,Dr Ravinder Singh,"RS Uppal, RP Singh, JS Jagrup Singh",Effect of nitrogen levels and time of application on quality of durum wheat.,2002,Undisclosed,Other,15
405,Dr Ravinder Singh,"R Singh, TR Nandal, SK Sharma",Efficacy and economics of some herbicides for weed control in onion (Allium cepa L.).,1996,Undisclosed,Other,15
406,Dr Ravinder Singh,RP Singh,Electron Interactions in White Dwarf Stars.,1957,"Astrophysical Journal, vol. 126, p. 213",Journal article,15
407,Dr Ravinder Singh,"P Sahu, A Chug, AP Singh, D Singh, RP Singh",Challenges and issues in plant disease detection using deep learning,2021,Handbook of research on machine learning techniques for pattern recognition …,Other,14
408,Dr Ravinder Singh,"P Kumar, Priyanka, A Pathania, S Agarwal, N Mali, R Singh, P Chaturvedi, ...","Predictions of weekly slope movements using moving-average and neural network methods: a case study in Chamoli, India",2020,"Soft Computing for Problem Solving 2019: Proceedings of SocProS 2019, Volume …",Conference paper,14
409,Dr Ravinder Singh,"P Kumar, P Sihag, A Pathania, S Agarwal, N Mali, R Singh, P Chaturvedi, ...","Predictions of weekly soil movements using moving-average and support-vector methods: a case-study in Chamoli, India",2019,International Conference on Inforatmion technology in Geo-Engineering,Conference paper,14
410,Dr Ravinder Singh,"AK Singh, L Agarwal, A Kumar, C Sengupta, RP Singh","Prevalence of nasal colonization of methicillin-resistant Staphylococcus aureus among schoolchildren of Barabanki district, Uttar Pradesh, India",2018,Journal of family medicine and primary care,Journal article,14
411,Dr Ravinder Singh,"RP Singh, SK Verma, RK Singh",Effects of herbicides on growth and yield of Cicer arietinum L. under rainfed condition,2016,Bangladesh Journal of Botany,Journal article,14
412,Dr Ravinder Singh,"S Kumar, AK Choubey, R Singh",Analysis of Yield Gaps in Black Gram (Vigna mungo) in District Bilaspur of Himachal Pradesh,2015,Himachal Journal of Agricultural Research,Journal article,14
413,Dr Ravinder Singh,"RK Singh, SK Verma, RP Singh",Weed management in groundnut with imazethapyr+ surfactant,2014,Indian Society of Weed Science,Journal article,14
414,Dr Ravinder Singh,"M Kaur, A Mehta, SK Gupta, D Singh, RP Singh",Protein content and quality of bread wheat grains as affected by FYM and nitrogen management,2006,Crop improvement,Journal article,14
415,Dr Ravinder Singh,"AS Yadav, NK Pandey, RP Singh, RD Sharma",Effect of garlic extract and cinnamon powder on microbial profile and shelf life of minced chicken meat.,2002,Undisclosed,Other,14
416,Dr Ravinder Singh,"BS Kumpawat, RP Singh, SS Rathore",Response of chickpea varieties to phosphorus.,1990,Undisclosed,Other,14
417,Dr Ravinder Singh,"CS Sunandana, R Singh",An infrared study of the glass system CaO. B2O3. Al2O3. xFe2O2 (0< x< 1),1983,Undisclosed,Other,14
418,Dr Ravinder Singh,"RP Singh, RR Singh, SP Singh, RV Singh",Estimation of genetic component of variation in rice.,1981,Undisclosed,Other,14
419,Dr Ravinder Singh,R Singh,Geetanjali (2013). Nutraceuticals: Promising Health Product,Unknown,"Intern Res J Med Sci 1 (1), 14-17,",Other,14
420,Dr Ravinder Singh,"NR Patel, S Pokhariyal, RP Singh",Advancements in remote sensing based crop yield modelling in India,2023,Journal of Agrometeorology,Journal article,13
421,Dr Ravinder Singh,"S Kumar, P Kumar, K Bhatt, S Shrivastva, A Kumar, R Singh, R Punia, ...",Impact of triple roll milling processing parameters on fluidic/rheological and electrical properties of aqueous graphene ink,2020,Advanced Engineering Materials,Journal article,13
422,Dr Ravinder Singh,"L Agarwal, AK Singh, A Agarwal, RP Singh",Incidental detection of hepatitis B and C viruses and their coinfection in a hospital-based general population in tertiary care hospital of Uttar Pradesh,2018,Journal of family medicine and primary care,Journal article,13
423,Dr Ravinder Singh,"A Kumar, R Singh, I Singh",A review of metal inert gas welding on aluminium alloys,2017,International Journal of Engineering Sciences &Research Technology 6 (5 …,Journal article,13
424,Dr Ravinder Singh,"RB Singh, RN Nishad, RP Singh",Relative efficacy of botanicals against pulse beetle (Callosobruchus chinensis L.) infestation in chickpea during storage,2017,Environ. Pharmacolo. and Life Sci,Journal article,13
425,Dr Ravinder Singh,"AK Sinha, RP Singh",Influence of cultivars under different tillage and weed management in wheat,2005,Indian Journal of Weed Science 37 (3and4),Journal article,13
426,Dr Ravinder Singh,"CS Chopra, P Singh, RP Singh",Studies on preparation of jelly from wood apple (Limonia acidissima L.) fruit,2003,Beverage and Food World,Journal article,13
427,Dr Ravinder Singh,"DC Chaudhary, RP Singh, NP Singh",Productivity of urdbean varieties as influenced by planting dates.,1989,Undisclosed,Other,13
428,Dr Ravinder Singh,"AK Mehta, RP Singh, G Lal","Effect of concentration and methods of application of 2, 4-D phenoxy acetic acid on yield, fruit quality and seed quality of tomato (Lycopersicon esculentum Mill)",1989,Veg. Sci,Journal article,13
429,Dr Ravinder Singh,"RP Singh, J Seth",Nitrogen uptake and potential for production of dry matter in dwarf wheat as influenced by soil and foliar application of nitrogen.,1978,Undisclosed,Other,13
430,Dr Ravinder Singh,"K Darji, D Patel, AK Dubey, P Gupta, R Singh","An approach of satellite and UAS based Mosaicked DEM for hydrodynamic modelling—a case of flood assessment of Dhanera City, Gujarat, India",2021,J geomatics,Book chapter,12
431,Dr Ravinder Singh,"S Kumar, RP Singh, JG Kalambukattu","Modeling daily surface runoff, sediment and nutrient loss at watershed scale employing Arc-APEX model interfaced with GIS: a case study in Lesser Himalayan landscape",2021,Environmental Earth Sciences,Journal article,12
432,Dr Ravinder Singh,"RP Singh, N Banerjee",The mediating role of brand credibility on celebrity credibility in building brand equity and immutable customer relationship: The mediating role of brand credibility on …,2021,Undisclosed,Other,12
433,Dr Ravinder Singh,"SRK Dubey, SK Patel, AK Arya, RP Singh",Clinico-etiological spectrum of pancytopenia in hospitalized children,2016,Int J Contemp Pediatr,Journal article,12
434,Dr Ravinder Singh,"S Pallagatti, S Sheikh, A Aggarwal, R Singh, D Gupta, A Kaur",Maxillofacial imaging: An emerging tool in forensic science,2011,"J Forensic Res 2 (6), 2.",Journal article,12
435,Dr Ravinder Singh,"R Singh, HS Dhaliwal, AS Joshi",Contract farming of floriculture in Punjab-problems and prospects,2006,Journal of Ornamental Horticulture,Journal article,12
436,Dr Ravinder Singh,"A Mehta, M Kaur, SK Gupta, RP Singh","Physico-chemical, rheological and baking characteristics of bread wheat as affected by farm yard manure and nitrogen management",2006,Res Punjab Agic Univ,Journal article,12
437,Dr Ravinder Singh,R Singh,Geetanjali and SMS Chauhan,2004,Chem. Biodiversity,Journal article,12
438,Dr Ravinder Singh,"R Kalhan, I Kaur, RP Singh, HC Gupta",Latex agglutination test (LAT) for the diagnosis of typhoid fever.,1999,Indian pediatrics,Journal article,12
439,Dr Ravinder Singh,"B Singh, V Singh, RP Singh, BK Srivastava",Economic prospects of vegetable intercropping in young Eucalypts plantation,1998,Annals of Agricultural Research,Journal article,12
440,Dr Ravinder Singh,"PG Karmakar, RP Singh",Combining ability in early peas.,1990,Undisclosed,Other,12
441,Dr Ravinder Singh,"RP Singh, S Singh","A study of interaction of additive, dominance and epistatic gene effects with micro-and macro-environments in two tomato triple test crosses",1984,The Journal of Agricultural Science,Journal article,12
442,Dr Ravinder Singh,"A Bhatia, A Chug, AP Singh, RP Singh, D Singh",A forecasting technique for powdery mildew disease prediction in tomato plants,2021,Proceedings of Second Doctoral Symposium on Computational Intelligence …,Conference paper,11
443,Dr Ravinder Singh,B SINGH,SINGH 7s,2020,Undisclosed,Other,11
444,Dr Ravinder Singh,"AK Singh, DM Kadam, M Saxena, RP Singh",Effect of soy flour supplementation on the quality and shelf life of Gulabjamuns,2011,International Journal of Food Science and Nutrition Engineering,Journal article,11
445,Dr Ravinder Singh,"S Ghorai, R Singh",Linear stability analysis of gyrotactic plumes,2009,Physics of Fluids,Journal article,11
446,Dr Ravinder Singh,"KH Mohsen, IA Ibrahim, HA Emara, E Komor",Impact of polyethylene glycol-induced water stress on growth and development of shoot tip cultures from different banana (Musa spp.) cultivars,2006,Journal of Applied Horticulture,Journal article,11
447,Dr Ravinder Singh,"RP Singh, D Mukherjee, RK Singh, AK Sinha",Bioefficacy of herbicides in late-sown wheat (Triticum aestivum),2003,Indian Journal of Agronomy,Journal article,11
448,Dr Ravinder Singh,"R Singh, UK Kohli",Effect of NPK regimes on growth and developmental characters of tomato hybrids.,1999,Undisclosed,Other,11
449,Dr Ravinder Singh,"RP Singh, RR Singh, SP Singh, RV Singh",Combining ability for yield components in rice.,1981,Undisclosed,Other,11
450,Dr Ravinder Singh,"V Singh, R Shri, P Sood, M Singh, TG Singh, R Singh, A Kaur, A Kumar, ...","3-hydroxy-3′, 4′, 5′-trimethoxyflavone protects rats against lead-induced neurotoxicity via chelation and modulating oxidative stress, inflammatory and monoaminergic systems",2024,Journal of Functional Foods,Journal article,10
451,Dr Ravinder Singh,"R Tripathi, VK Chaurasiya, A Kumar, R Singh",Minimization of entropy production in the transient thermocapillary flow of  hybrid nanoliquid film over a disk: R Tripathi et al.,2022,Indian Journal of Physics,Journal article,10
452,Dr Ravinder Singh,"P Sahu, A Chug, AP Singh, D Singh, RP Singh",Classification and activation map visualization of banana diseases using deep learning models,2021,International Conference on Innovative Computing and Communications …,Conference paper,10
453,Dr Ravinder Singh,"CM Biradar, S Ghosh, F Löw, R Singh, P Chandna, A Sarker, RN Sahoo, ...",Geo big data and digital augmentation for accelerating agroecological intensification in drylands,2019,"The International Archives of the Photogrammetry, Remote Sensing and Spatial …",Journal article,10
454,Dr Ravinder Singh,"M Arora, R Singh, MK Panda",Effects of magnetic-field-dependent viscosity at onset of convection in magnetic nanofluids,2016,Journal of Engineering Mathematics,Journal article,10
455,Dr Ravinder Singh,"S Ghorai, R Singh, NA Hill",Wavelength selection in gyrotactic bioconvection,2015,Bulletin of mathematical biology,Journal article,10
456,Dr Ravinder Singh,"SM Moorthi, AS Arya, K Mathew, RP Singh, P Chauhan, SS Sarkar, S Roy, ...",Mars orbiter mission: science data products and archive pipeline,2015,46th Annual lunar and planetary science conference,Conference paper,10
457,Dr Ravinder Singh,"RS Mehta, BS Patel, SS Meena, G Lal, R Singh",Water dynamics and yield of fenugreek (Trigonella-foenium-graecum L.) as influenced by irrigation scheduling and weed management practices,2014,International Journal of Seed Spices,Journal article,10
458,Dr Ravinder Singh,"MK Sharma, R Singh",Linear stability analysis of double-diffusive convection in magnetic nanofluids in porous media,2014,Journal of Porous Media,Journal article,10
459,Dr Ravinder Singh,"AP Singh, RP Singh, JS Jagdish Singh, SK Shahi",Integrated response of inorganic and bio-fertilizers on yield and yield attributes of turmeric.,2012,Undisclosed,Other,10
460,Dr Ravinder Singh,"M Mergoum, P Singh, JA Anderson, RJ Peiia, RP Singh, SS Xu, ...",Hand Book of plant breeding partly from Spring Wheat Breeding,2009,North Dakota State University. Fargo ND,Book chapter,10
461,Dr Ravinder Singh,"AK Sinha, RP Singh",Studies on the effect of herbicides under different tillage practices in wheat,2005,Indian Journal of weed science 37 (3and4),Journal article,10
462,Dr Ravinder Singh,"Z Shi, X Lv, F Zhao, A Majumdar, D Ray, R Singh, XJ Yan",[110] Orientated lead salt midinfrared lasers,2004,Applied physics letters,Journal article,10
463,Dr Ravinder Singh,"M Shariff, M Deb, R Singh, K Singh",Cryptosporidium infection in children with diarrhoea of acute onset.,2002,Undisclosed,Other,10
464,Dr Ravinder Singh,"S Gupta, VK Khanna, R Singh, GK Garg",Effect of media and explant on callus formation and plant regeneration in sorghum,2002,JOURNAL OF PLANT BIOLOGY-NEW DELHI,Journal article,10
465,Dr Ravinder Singh,"CS Chopra, RP Singh",Studies on extraction of pulp from woodapple (Limonia acidissima L.) fruit,2001,Beverage and Food World,Journal article,10
466,Dr Ravinder Singh,"R Singh, D Chandra, BS Rathore, KP Singh, ML Mehrotra",Investigation of mortality in cattle and buffaloes with particular reference to hepatic schistosomosis in cattle.,2000,Undisclosed,Other,10
467,Dr Ravinder Singh,"R Singh, UK Kohli, TR Nandal",Efficacy of some selected weedicides against onion weeds in Himachal Pradesh.,1997,Undisclosed,Other,10
468,Dr Ravinder Singh,"SK Singh, RP Singh, RB Singh",Profit evaluation in two units cold standby system having two types of independent repair facilities,1992,IJOMAS,Journal article,10
469,Dr Ravinder Singh,"RP Singh, AK Rai",Genetics of quantitative characters in bread wheat.,1987,Undisclosed,Other,10
470,Dr Ravinder Singh,"RP Singh, R Gopal",Persistency and peak milk yield of cattle in a rural area.,1982,Undisclosed,Other,10
471,Dr Ravinder Singh,"RP Singh, RP Singh, J Seth",Nitrogen and phosphorus management of wheat under the condition of delayed availability of fertilizers.,1980,Undisclosed,Other,10
472,Dr Ravinder Singh,"SP Singh, RP Singh, RP Singh, RV Singh",Combining ability in rice.,1980,Undisclosed,Other,10
473,Dr Ravinder Singh,"RP Singh, RG Anderson",Dry-matter accumulation in wheat plants as influenced by nitrogen fertilization.,1978,Undisclosed,Other,10
474,Dr Ravinder Singh,"NS Khokhar, RP Singh, M Parshad","Effect of different levels of nitrogen, phosphorus, potassium and FYM on the yield of cabbage.",1970,Undisclosed,Other,10
475,Dr Ravinder Singh,"K Aditya, R Singh, M Kumar, R Vega, A Dixit",Impact of gamma-ray radiation on DC and RF performance of 10-nm bulk N-channel FinFETs,2020,IEEE Transactions on Device and Materials Reliability,Journal article,9
476,Dr Ravinder Singh,"R Singh, AK Thakur, A Gehlot","Akhilesh Internet of things based on home automation for intrusion detection, smoke detection, smart appliance and lighting control",2019,Int. J. Sci. Technol. Res,Journal article,9
477,Dr Ravinder Singh,"G Kashyap, R Singh, RK Agrawal, YPS Malik, KP Singh, P Kumar, ...",Etiopathology of intestinal affections in bovine calves,2017,Indian Association of Veterinary Pathologists,Journal article,9
478,Dr Ravinder Singh,"R Singh, R Singh, H Kaur, OP Gupta",Development of online student course registration system,2016,Orient. J. Chem,Journal article,9
479,Dr Ravinder Singh,"C Lav, C Kaul, RK Singh, A Rai",Potential of micro turbines for small scale power generation,2013,"Life 10, 15,000",Other,9
480,Dr Ravinder Singh,"A Kumar, S Vinayak, R Singh",Investigation of current-voltage characteristics of Ni/GaN schottky barrier diodes for potential HEMT applications,2011,Видавництво СумДУ,Other,9
481,Dr Ravinder Singh,"AK Dhawan, K Singh, R Singh",Evaluation of new insecticidal combination of pyridalyl with synthetic pyrethroid for the management of bollworm complex on cotton,2009,Pesticide Research Journal,Journal article,9
482,Dr Ravinder Singh,"A Singh, RK Patel, RP Singh","Correlation studies of chemical fertilizers and biofertilizers with growth, yield and nutrient status of olive trees (Olea european)",2003,Indian Journal of Hill Farming (India) 16 (1-2),Journal article,9
483,Dr Ravinder Singh,"S Kumar, CJ Singh, RP Singh, J Kachari",Microfine cement: Special superfine Portland cement,2002,"Proceedings of the 7th NCB International Seminar, New Delhi, India",Conference paper,9
484,Dr Ravinder Singh,"A Singh, R Singh, R Singh, A Singh",Nutrient uptake and biomass production by oat varieties as influenced by moisture regimes and nitrogen application,1995,Ann. Agric. Res,Journal article,9
485,Dr Ravinder Singh,"V Singh, RP Singh, KS Panwar, SM Singh",EFFECT OF INOCULATION WITH AZOTOBACTER ON WHEAT (TRITICUM-AESTIVUM),1993,Indian Journal of Agronomy,Journal article,9
486,Dr Ravinder Singh,"RP Singh, S Bhan","Yield, quality and economics of summer cotton (Gossypium species) as influenced by frequency of irrigation and moisture-conservation practices",1993,"Indian Journal of Agronomy 38 (3), 38_3-38_",Journal article,9
487,Dr Ravinder Singh,"RP Singh, HC Joshi, M Kumar",Experimental bracken fern toxicity in calves: changes in blood and urine.,1987,Undisclosed,Other,9
488,Dr Ravinder Singh,"R SINGH, A SINGH, HL Chopra, S SINGH",Cystosarcoma phyllodes: A review of 22 patients plus a case report of the youngest patient recorded in the literature,1982,Australian and New Zealand Journal of Surgery,Journal article,9
489,Dr Ravinder Singh,RP Singh,Combining ability in relation to chilli breeding,1982,MADRAS AGRICULTURAL JOURNAL,Journal article,9
490,Dr Ravinder Singh,"SP Singh, RP Singh, GS Singh","Influence of age at first calving on milk yield, lactation length and calving interval in Gangatiri (medium Haryana) cows.",1982,Undisclosed,Other,9
491,Dr Ravinder Singh,"H Singh, PN Bhat, R Singh",Association of protein polymorphic genotypes with certain performance traits in cross-bred cattle.,1981,Undisclosed,Other,9
492,Dr Ravinder Singh,"A Kaur, U Sharma, S Singh, R Singh, Y Vikal, S Singh, P Malik, K Kaur, ...",Introgressing cry1Ac for pod borer resistance in chickpea through marker-assisted backcross breeding,2022,Frontiers in genetics,Journal article,8
493,Dr Ravinder Singh,"D Prabhakaran, D Jha, D Prieto-Merino, A Roy, K Singh, VS Ajay, ...",Members of the Research Steering Committee ‚Investigators ‚Members of the Data SafetyMonitoring Board. Effectiveness of an mHealth-based electronic decision support system for …,2019,Circulation,Journal article,8
494,Dr Ravinder Singh,"RP Singh, PK Jain, AV Ajay Verma, RK Jhade",Yield and quality parameters of turmeric as influenced by application of bio-fertilizers and organic manures.,2015,Undisclosed,Other,8
495,Dr Ravinder Singh,R Singh,"ACS Catal. 2014, 4, 546.(b) Bordeaux, M.; Singh, R.; Fasan, R",2014,Bioorg. Med. Chem,Journal article,8
496,Dr Ravinder Singh,"E McQuinn, P Datta, MD Flickner, WP Risk, DS Modha, TM Wong, ...",2012 international science &engineering visualization challenge,2013,Science,Journal article,8
497,Dr Ravinder Singh,"R Singh, L Alpern, GJ Jaffe, RP Lehmann, J Lim, HJ Reiser, K Sall, ...",Evaluation of nepafenac in prevention of macular edema following cataract surgery in patients with diabetic retinopathy. Clin Ophthalmol 2012; 6: 1259–1269,2013,Undisclosed,Other,8
498,Dr Ravinder Singh,"RP Singh, A Embrandiri, MH Ibrahim, P Singh","Effect of different palm oil mill effluent (POME) concentrations on seed germination, seedling growth and physiological response of kidney bean (Phaseolus vulgaris)",2013,Journal of Environmental Science and Sustainability (JESS),Journal article,8
499,Dr Ravinder Singh,"R Singh, S Vij",Are Ethics Important for Competitive Intelligence Professionals?,2012,Amity Competitive Intelligence Conference (ACIC-2012) on'Competitive …,Conference paper,8
500,Dr Ravinder Singh,R Singh,Crowdsourced geospatial data,2012,GIM International,Journal article,8
501,Dr Ravinder Singh,RPB Singh,Ecospirituality in Indian Tradition: Messages for Global Order,2012,Environment ethics: Indian perspectives,Book chapter,8
502,Dr Ravinder Singh,"S Raghuwanshi, RK Pateria, RP Singh",A new protocol model for verification of payment order information integrity in online E payment system,2009,2009 World Congress on Nature &Biologically Inspired Computing (NaBIC …,Conference paper,8
503,Dr Ravinder Singh,"KD Bahukhandi, S Kumar, NA Siddiqui, R Singh, S Arora, P Mondal",Assessment of major ion chemistry and spatial variation of water quality of Ganga River of Uttarakhand,2008,J. Chem. Pharm. Res,Journal article,8
504,Dr Ravinder Singh,"V Kumar, AR Singh, RP Singh, PN Katiyar","Effect of GA3 and Ethrel on Growth, Flowering and Yield Attributes of Gladiolus CV. Congo Song",2008,Annals of Horticulture,Journal article,8
505,Dr Ravinder Singh,"RP Singh, AS Yadav, SS Verma",Effect of filleting and marination processes on the quality of roasted chicken breast fillets.,2002,Undisclosed,Other,8
506,Dr Ravinder Singh,"N Karthikeyan, RP Singh, TS Johri, VK Tanwar",Nutritional quality and palatability of pet food from poultry by-product meal,2002,The Indian Journal of Animal Sciences,Journal article,8
507,Dr Ravinder Singh,"AS Yadav, NK Pandey, RP Singh, RD Sharma",Microbial profile and shelf-life extension of dressed chickens as influenced by garlic extract and cinnamon powder,2002,Indian Journal of Poultry Science,Journal article,8
508,Dr Ravinder Singh,"RP Singh, HS Garcha, PK Khanna",Study of laccase enzyme in degradation of lignocellulosics.,1989,Undisclosed,Other,8
509,Dr Ravinder Singh,"K Vinod, TR Singh, SR Yadav, RP Singh",Employment and income pattern of women labour in modern agriculture in district Meerut (UP),1985,Indian Journal of Agricultural Economics,Journal article,8
510,Dr Ravinder Singh,R Singh,Distribution of ABO blood group in Nepal,1985,J Nepal Med Assoc,Journal article,8
511,Dr Ravinder Singh,"RK Gunthey, RP Singh",Mental health problems in relation to job satisfaction.,1982,Indian Journal of Applied Psychology,Journal article,8
512,Dr Ravinder Singh,RP Singh,Combining ability for grain weight and its components in rice.,1982,Undisclosed,Other,8
513,Dr Ravinder Singh,"RA Gupta, BN Singh, RN Singh",Screening of Ayurvedic drugs for analgesic activity,1982,J Sci Res Pl Med,Journal article,8
514,Dr Ravinder Singh,"RP Singh, KC Raut",Studies on the lactation curve for cows under village conditions.,1982,Undisclosed,Other,8
515,Dr Ravinder Singh,"RP Singh, KK Nigam, P Mishra",Developing and fully developed turbulent flow through annuli,1980,Journal of Chemical Engineering of Japan,Journal article,8
516,Dr Ravinder Singh,"RP Singh, DB Wilson",Effect of seedling depths and pre-sowing seed treatments on the seedling emergence of sunflower and safflower,1974,Indian J. Agron,Journal article,8
517,Dr Ravinder Singh,"M Katyal, RP Singh",Spectrophotometric determination of zirconium and other colour reactions by galangin,1963,Proceedings of the Indian Academy of Sciences-Section A,Conference paper,8
518,Dr Ravinder Singh,"S Agrohiya, R Singh, S Dahiya, I Rawal, A Ohlan, R Punia, AS Maan",Self-powered solar-blind UV photodetectors based on Zn: NiO/p-Si heterojunction devices,2023,Applied Physics A,Journal article,7
