,Author,Authors,Title,Year,Source,Type,Cites
1146,Dr Ravinder Singh,"GS Geeta Singh, S Saha, BK Sharma, R Garg, AB Rai, RP Singh",Evaluation of selected antagonists against Fusarium wilt disease of tomato.,2013,Undisclosed,Other,0
1147,Dr Ravinder Singh,"RK Singh, SK Dubey, RP Singh, D DasGupta",Study the adoption and area expansion of intervent technology through OFT and VT under Mandar Block of Ranchi district.,2013,Undisclosed,Other,0
1148,Dr Ravinder Singh,"RK Singh, SK Dubey, RP Singh, D DasGupta",Attitude and opinion changed of farmers after involvement under technology assessment and refinement programme.,2013,Undisclosed,Other,0
1149,Dr Ravinder Singh,"A Chauhan, R Gautam, RP Singh, RC Singh","Diurnal Characteristics of column-integrated Aerosol Optical and Radiative Properties over Kanpur, Indo-Gangetic Plains",2012,"AGU Fall Meeting Abstracts 2012, A21A",Abstract,0
1150,Dr Ravinder Singh,"DG Kaskaoutis, EE HOUSSOS, R Gautam, A Bartzokas, RP Singh, ...","ANALYSIS OF SYNOPTIC WEATHER AND ATMOSPHERIC CONDITIONS ASSOCIATED WITH AEROSOL EPISODES OVER INDO-GANGETIC PLAINS, INDIA.",2012,"AGU Fall Meeting Abstracts 2012, A21A",Abstract,0
1151,Dr Ravinder Singh,"RP Singh, J Huth, T Wagner, M Sharma, A Chauhan, S Singh, SN Pandey",FESEM Analysis showing evidence of aerosol Mixing over Indo-Gangetic Plains,2012,"AGU Fall Meeting Abstracts 2012, A21A",Abstract,0
1152,Dr Ravinder Singh,"S Kumar, AK Singh, RP Singh",Remote Sensing of Atmospheric Aerosol over Indo-Gangetic Basin during 2005-2009,2012,"AGU Fall Meeting Abstracts 2012, A21A",Abstract,0
1153,Dr Ravinder Singh,"NC Steinle, N Gupta, A Yuan, RP Singh",Chorioretinopathie–Trocknet Rifampicin die chronisch seröse Chorioretinopathie?,2012,Klinische Monatsblätter für Augenheilkunde,Journal article,0
1154,Dr Ravinder Singh,"NK Narendra Kumawat, RP Singh, RK Rakesh Kumar, ...",Response of intercropping and integrated nutrition on production potential and profitability on rainfed pigeonpea.,2012,Undisclosed,Other,0
1155,Dr Ravinder Singh,"DG Kaskaoutis, PR Sinha, SK Kharol, PG Kosmopoulos, RK Manchanda, ...",Aerosol Characteristics over Bay of Bengal During W-ICARB Cruise Campaign,2012,"Advances in Meteorology, Climatology and Atmospheric Physics",Book chapter,0
1156,Dr Ravinder Singh,"PN Tripathi, S Verma, RP Singh",Electron transfer quenching studies of luminescent complex’s of Ru (iii) with mixed ligands,2012,Journal of Experimental Sciences,Journal article,0
1157,Dr Ravinder Singh,"PT Preeti Tripathi, AM Aradhana Mishra, SD Sanjay Dwivedi, ...",Differential response of oxidative stress and thiol metabolism in contrasting rice genotypes for arsenic tolerance.,2012,Undisclosed,Other,0
1158,Dr Ravinder Singh,"JJ Jyoti Jha, NS Bains, RP Singh","Effect of genotype and environment on grain, rheological and baking qualify characteristics of advanced wheat lines.",2012,Undisclosed,Other,0
1159,Dr Ravinder Singh,"MM Jindal, SK Mann, NS Bains, RP Singh",Sources of resistance of wheat to Yr 27 virulence of stripe rust pathogen under Indian Punjab conditions.,2012,Undisclosed,Other,0
1160,Dr Ravinder Singh,"SC Sameer Chandra, SK Rawat, RP Singh, SK Garg",Water quality monitoring: to access the temporal and monsoonal variation in pollution level of river Gomti and some ponds in vicinity of Lucknow city (India).,2012,Undisclosed,Other,0
1161,Dr Ravinder Singh,"S Ak, R Singh, F Naz, SS Chauhan, A Dinda",Structure Based Design and Synthesis of Peptide Inhibitor of Human LOX-12: In Vitro and In,2012,Undisclosed,Other,0
1162,Dr Ravinder Singh,"S Goyal, S Mandal, R Garg, M Saxena, S Kumar, S Verma, D Siwal, ...","Effects of shell closure of target on neutron multiplicity for the {sup 28} Si+{sup 204,206,208} Pb",2011,Undisclosed,Other,0
1163,Dr Ravinder Singh,"V Kumar, P Thakur, AK Bhati, R Kumar, RP Singh, RK Bhowmik",Nuclear g-factor measurement of 31/2 {sup+} isomer in {sup 153} Ho,2011,Undisclosed,Other,0
1164,Dr Ravinder Singh,"RP Singh, R Gautam, TH Painter",Seasonal and inter-annual variability of aerosol optical properties during 2005-2010 over Red Mountain Pass and Impact on the Snow Cover of the San Juan Mountains,2011,"AGU Fall Meeting Abstracts 2011, A33D",Abstract,0
1165,Dr Ravinder Singh,"AK Archana Kumari, RP Singh, Y Yeshpal",Performance of mustard hybrids under different sowing dates and spacings.,2011,Undisclosed,Other,0
1166,Dr Ravinder Singh,"E Hasker, SP Singh, P Malaviya, A Picado, K Gidwani, RP Singh, ...","Risk factors for visceral leishmaniasis in a rural district of Bihar, India, a multilevel analysis",2011,TROPICAL MEDICINE &INTERNATIONAL HEALTH,Journal article,0
1167,Dr Ravinder Singh,"DK Singh, VK Singh, RP Singh",Stionic effect on vegetative growth attributes in rose (Rosa species).,2011,Undisclosed,Other,0
1168,Dr Ravinder Singh,"DK Singh, P Kumar, NM Neelam Mishra, RP Singh, V Dwivedi","Interactive effect of cobalt, boron and molybdenum on phosphorus uptake by pea (Pisum sativum L.).",2011,Undisclosed,Other,0
1169,Dr Ravinder Singh,"VK Chorasiya, K Makki, RP Singh, RK Vasudevan, P Dargan, N Goyal, ...",Predictors of Poor Outcome Following LRLT in Adults with End Stage Liver Disease,2011,"LIVER TRANSPLANTATION 17 (6), S168-S",Journal article,0
1170,Dr Ravinder Singh,"S Pareek, N Goyal, V Chaurasia, RP Singh, KR Vasudevan, P Dargan, ...",HLA in Living Related Liver Transplantation-Is It Necessary,2011,"LIVER TRANSPLANTATION 17 (6), S277-S",Journal article,0
1171,Dr Ravinder Singh,"K Makki, V Chorasiya, R Ray, V Vij, N Goyal, P Dargan, RK Vasudevan, ...",Techniques of Portal Vein Reconstruction in Pediatric Liver Transplant Recipients at Our Centre,2011,"LIVER TRANSPLANTATION 17 (6), S294-S",Journal article,0
1172,Dr Ravinder Singh,"K Makki, V Chorasiya, M Wadhawan, N Goyal, V Vij, P Dargan, ...",Recidivism after Liver Transplant in Acute Alcoholic Hepatitis vs Alcoholic Chronic Liver Disease: Do the Results Justify Transplant in Nonabstinent Alcoholics?,2011,"LIVER TRANSPLANTATION 17 (6), S286-S",Journal article,0
1173,Dr Ravinder Singh,"R Ray, K Makki, N Goyal, RK Vasudevan, P Dargan, S Gupta, ...",Complications Requiring Abdominal Exploration Following Living Related Liver Transplantation: An Analysis of 424 Consecutive LRLTs,2011,"LIVER TRANSPLANTATION 17 (6), S237-S",Journal article,0
1174,Dr Ravinder Singh,"N Goyal, K Makki, V Vij, P Dargan, KRV Vasudevan, R Singh, ...",Towards 100% Triphasic Flow in Right Hepatic Vein and Avoidance of Right Hemidiaphragmatic Paralysis in Right Lobe Living Related Liver Transplants-Technical Modifications,2011,"LIVER TRANSPLANTATION 17 (6), S181-S",Journal article,0
1175,Dr Ravinder Singh,"VK Chorasiya, K Makki, RP Singh, RK Vasudevan, P Dargan, N Goyal, ...",Incidence of Portal Venous Thrombosis in Patients of Chronic Liver Disease and Its Management during Living Related Liver Transplant,2011,"LIVER TRANSPLANTATION 17 (6), S183-S",Journal article,0
1176,Dr Ravinder Singh,"M Paritosh, RP Singh, SP Singh, H Epco, O Bart, S Ravi, B Marleen, ...","Monitoring drug effectiveness in kala-azar in Bihar, India: cost and feasibility of periodic random surveys versus a health service-based reporting system",2011,Tropical medicine &international health: TM &IH,Journal article,0
1177,Dr Ravinder Singh,"SR Shobha Rawat, DK Upreti, RP Singh","Estimation of epiphytic lichen litter fall biomass in three temperate forests of Chamoli district, Uttarakhand, India.",2011,Undisclosed,Other,0
1178,Dr Ravinder Singh,"PM Paritosh Malaviya, A Picado, SP Singh, E Hasker, RP Singh, ...","Visceral Leishmaniasis in Muzaffarpur district, Bihar, India from 1990 to 2008.",2011,Undisclosed,Other,0
1179,Dr Ravinder Singh,"R Singh, A Behari, A Gupta, V Kapoor, R Saxena",Post-pancreaticoduodenectomy hemorrhage in periampullary carcinoma: results and outcome according to the ISGPS classification,2011,BRITISH JOURNAL OF SURGERY,Journal article,0
1180,Dr Ravinder Singh,"R Singh, V Kapoor, V Kumar",MSC702 (MTCC 10772),2011,Undisclosed,Other,0
1181,Dr Ravinder Singh,"LP Singh, AS Yadav, RP Singh, NK Pandey, SS Dangi, R Saxena",Detection and quantification of Salmonella on chicken egg shell by real time PCR,2011,The Indian Journal of Animal Sciences,Journal article,0
1182,Dr Ravinder Singh,"S Bhushan, RP Singh, RS Ravi Shanker",Field evaluation of different insecticidal modules against pod borer (Helicoverpa armigera) and pod fly (Melanagromyza obtusa) in pigeonpea.,2011,Undisclosed,Other,0
1183,Dr Ravinder Singh,"BK Sharma, RP Singh, S Saha, A Kumar, AB Rai","Indian Society of Horticultural Research and Development, Uttarakhand",2011,PROGRESSIVE HORTICULTURE,Journal article,0
1184,Dr Ravinder Singh,"BK Sharma, RP Singh, S Saha, AB Rai",Determination of inoculum threshold of Fusarium oxysporum f. sp. lycopersici and its delivery system in tomato.,2011,Undisclosed,Other,0
1185,Dr Ravinder Singh,"VK Singh, RP Singh",Response of Rhizobium VA-mycorrhiza and phosphorus on yield and yield contributing characters of pea (Pisum sativum L.).,2011,Undisclosed,Other,0
1186,Dr Ravinder Singh,"SK Mishra, A Rajawat, RP Singh",Exploring NISC Architectures for Matrix Application,2011,Undisclosed,Other,0
1187,Dr Ravinder Singh,"MPN Naseef, H Kumar, R Ali, M Afzal Ansari, D Singh, KS Golda, ...",Fusion incompleteness in {sup 16} O induced reactions with {sup 175} Lu between 70-100 MeV energy,2010,Undisclosed,Other,0
1188,Dr Ravinder Singh,"D Siwal, V Suyal, A Prasad, SK Mandal, R Palit, R Singh",Signal noise filtration of gamma tracking detectors using empirical mode decomposition method,2010,Undisclosed,Other,0
1189,Dr Ravinder Singh,"RP Singh, PS Bhattacharjee",Comparison of Ozone and Water Vapor Retrieved From Airbus In-Service Aircraft (MOZAIC) and AIRS data over Delhi,2010,"AGU Fall Meeting Abstracts 2010, A51D",Abstract,0
1190,Dr Ravinder Singh,RP Singh,Notice of Retraction: Nitrogen removal efficiency of different filter media and macrophyte in pilot-scale constructed wetland,2010,2010 The 2nd Conference on Environmental Science and Information Application …,Conference paper,0
1191,Dr Ravinder Singh,"AK Singh, S Singh, RP Singh",Drifting ELF/VLF Emissions Observed at Low Latitude Ground Station During Geomagnetic Storm,2010,"Earth, Moon, and Planets",Journal article,0
1192,Dr Ravinder Singh,"NC Steinle, MR Barakat, PK Kaiser, RP Singh",Comparison of Retinal Thickness Measurements Between the Cirrus HD-OCT and the OPKO Spectral OCT/SLO,2010,Investigative Ophthalmology &Visual Science,Journal article,0
1193,Dr Ravinder Singh,"A Kumar, R Daga, A Prakash, R Singh, A Behari, V Kapoor, R Saxena",CARCINOMA RECTUM: A DISEASE OF AGGRESSION IN YOUNG PATIENTS,2010,DISEASES OF THE COLON &RECTUM,Journal article,0
1194,Dr Ravinder Singh,"S Venkataramanan, A Gupta, KS Golda, RP Singh, RK Bhowmik, V Balagi, ...",A compact pulse shape discriminator electronics for large neutron arrays,2010,Undisclosed,Other,0
1195,Dr Ravinder Singh,"S Singh, AK Singh, RP Singh",Characteristics of ELF/VLF drifting emissions observed at low latitude station Varanasi during geomagnetic substorms,2010,Journal of Physics: Conference Series,Conference paper,0
1196,Dr Ravinder Singh,"AK Singh, RP Patel, R Singh, KK Singh, AK Singh",A generation mechanism of chorus emissions using BWO theory,2010,Journal of Physics: Conference Series,Conference paper,0
1197,Dr Ravinder Singh,"D Montanari, L Corradi, FC Crespi, AM Stefanini, S Leoni, F Recchia, ...",Population and y-decay studies of neutron-rich nuclei around 48Ca with deep inelastic collisions,2010,Undisclosed,Other,0
1198,Dr Ravinder Singh,"CS Yadav, R Singh",Performance evaluation of information systems,2010,Indian Journal of Scientific Research,Journal article,0
1199,Dr Ravinder Singh,"JJ Jyoti Jha, NS Bains, RP Singh",Influence of genotype and environment on quality characteristics of wheat lines derived from winter wheat× spring wheat crosses.,2010,Undisclosed,Other,0
1200,Dr Ravinder Singh,"SP Sukram Pal, PC Parveen Chhuneja, AS Achla Sharma, RP Singh, ...",Introgression of quality traits from Triticcum dicoccoides to bread wheat variety PBW 343.,2010,Undisclosed,Other,0
1201,Dr Ravinder Singh,"M Kumar, RP Singh, S Panigrahy, AS Raghubanshi","Assessment of Agro-Ecosystem Carbon Stock in a Part of Middle Gangetic Plains, India",2010,Crop Improvement,Journal article,0
1202,Dr Ravinder Singh,"MK Manoj Kumar, RP Singh, S Panigrahy, AS Raghubanshi","Assessment of agro-ecosystem carbon stock in a part of middle gangetic plains, India.",2010,Undisclosed,Other,0
1203,Dr Ravinder Singh,"R Garg, S Kumar, M Saxena, S Goyal, D Siwal, S Kalkal, S Verma, ...",In beam Spectroscopy of Negative Parity States in 135 Pr,2010,DAE-BRNS symposium on nuclear physics. V.,Conference paper,0
1204,Dr Ravinder Singh,"PK Dubey, V Tripathi, RP Singh, GT Sharma",Expression of neuronal nitric oxide synthase in buffalo (Bubalus bubalis) ovarian antral follicle.,2010,Undisclosed,Other,0
1205,Dr Ravinder Singh,"RS Rajkumar, AS Yadav, M Kirupasankar, BD Sharma, RP Singh",Short Communications Efficacy of acidified sodium chlorite (ASC) and tri-sodium phosphate (TSP) in decontaminating chicken carcass against Campylobacter coli,2010,Indian Journal of Animal Sciences,Journal article,0
1206,Dr Ravinder Singh,"A Dubey, A Bohra, N Kumar, R Saxena, RV Penmetsa, RV Cheung, ...",Large scale development of BAC-end associated SSR markers in Pigeonpea [Cajanus cajan (L.) Millspaugh],2010,Plant &Animal Genome Conference XVIII,Conference paper,0
1207,Dr Ravinder Singh,"PS Bhattacharjee, RP Singh",Dynamics of trace gases and aerosols over the Indo-Gangetic plain,2009,"AGU Fall Meeting Abstracts 2009, A31D",Abstract,0
1208,Dr Ravinder Singh,"S Singh, E Hasker, A Picado, K Gidwani, P Malaviya, R Singh, M Boelaert, ...",Risk factors for visceral leishmaniasis in India: the role of domestic animals,2009,TROPICAL MEDICINE &INTERNATIONAL HEALTH,Journal article,0
1209,Dr Ravinder Singh,"S Kalkal, S Mandal, R Garg, S Verma, S Kumar, M Saxena, S Goyal, ...","Measurement of transfer reaction cross sections for {sup 28} Si+{sup 90, 94} Zr in sub-barrier and near barrier regions",2009,Undisclosed,Other,0
1210,Dr Ravinder Singh,"N Karthikeyan, RP Singh, AS Yadav, CK Beura",Incorporation of poultry by-product meals in pet food on growth and digestibility of nutrients in pups,2009,The Indian Journal of Animal Sciences,Journal article,0
1211,Dr Ravinder Singh,"RP Singh, E Shusterman, D Moshfeghi, TA Gardiner, M Gertner",Pre-clinical Evaluation of Oraya’s IRay System for Delivery of Microcollimated Pars Plana External Beam Radiation to the Eye,2009,Investigative Ophthalmology &Visual Science,Journal article,0
1212,Dr Ravinder Singh,"MK Manoj Kumar, RK Rajesh Kumar, RP Singh",Effect of micronutrients and plant growth regulators on fruiting of litchi.,2009,Undisclosed,Other,0
1213,Dr Ravinder Singh,"S Kalkal, S Mandal, N Madhavan, E Prasad, S Verma, A Jhingan, ...","Measurement of fusion excitation functions around the Coulomb barrier for 28 Si+ 90, 94 Zr systems",2009,Proceedings of the International Symposium on Nuclear Physics,Conference paper,0
1214,Dr Ravinder Singh,"A Tank, R Singh, A Prakash, A Behari, A Kumar, V Kapoor, R Saxena",IMPACT OF ADJUVANT THERAPY IN AMPULLARY CARCINOMA,2009,ANNALS OF ONCOLOGY,Journal article,0
1215,Dr Ravinder Singh,"S Roy, P Datta, S Pal, S Chattopadhyay, A Goswami, S Bhattacharyay, ...",Observation of triaxial deformation in 110 Ag isotopes,2009,Proceedings of the International Symposium on Nuclear Physics,Conference paper,0
1216,Dr Ravinder Singh,"RK Pande, D Burman, R Singh",and Management,2009,Disaster Prevention and Management,Journal article,0
1217,Dr Ravinder Singh,"AT Akshay Talukdar, KV Khushbu Verma, DSS Gowda, SK Lai, RL Sapra, ...",Molecular breeding for charcoal rot resistance in soybean. I. Screening and mapping population development.,2009,Undisclosed,Other,0
1218,Dr Ravinder Singh,"SS Shweta Somvanshi, AS Yadav, RS Rajkumar, RP Singh",Detection of thermophllic campylobacter from live chicken and their eggs by using conventional and molecular techniques.,2009,Undisclosed,Other,0
1219,Dr Ravinder Singh,"R Singh, G Kaur, BR Thapa, R Prasad",Molecular characterization of mutations in GALT gene in galactosemia patients from North-West India,2008,"JOURNAL OF GASTROENTEROLOGY AND HEPATOLOGY 23, A160-A",Journal article,0
1220,Dr Ravinder Singh,"S Roy, P Datta, S Pal, S Chattopadhyay, A Goswami, S Bhattacharyay, ...",Interplay of principal and tilted axis rotations in odd-odd Ag isotopes,2008,Undisclosed,Other,0
1221,Dr Ravinder Singh,"RP Singh, C Sonnie, D Moshfeghi, PK Kaiser, JE Sears",Long-Term Outcomes of Scleral Sutured Posterior Chamber Lens Implantation versus Anterior Chamber Intraocular Lens Implantation for Aphakia,2008,Investigative Ophthalmology &Visual Science,Journal article,0
1222,Dr Ravinder Singh,"V Bhaskara, S Alex, R Singh",Storm sudden commencements at Indian stations and associated changes in interplanetary magnetic field orientation,2008,37th COSPAR Scientific Assembly,Journal article,0
1223,Dr Ravinder Singh,"V Bhaskara, S Alex, R Singh",The day time electric field disturbances at equator and associated changes in interplanetary electric field and the ionospheric plasma density during intense magnetic storm periods,2008,37th COSPAR Scientific Assembly,Journal article,0
1224,Dr Ravinder Singh,"T Singh, SK Singh, RP Singh, PK Singh, SR Singh","Effect of Fertility and Silicon Levels on Yield Attributes, Yield and Economics of Rice Cultivars under Dryland Condition",2008,Indian Journal of Dryland Agricultural Research and Development,Journal article,0
1225,Dr Ravinder Singh,"HS Balyan, PK Gupta, A Kumar, J Kumar, R Singh, T Garg, P Chhuneja",QTL for grain color and yield traits in bread wheat and their correspondence in rice genome,2008,Undisclosed,Book,0
1226,Dr Ravinder Singh,"RP Singh, S Kumar, PC Kumar, R Chaudhary",The Interaction of Vanadyl Ions With Gliadin by Spectrophotometric and Ph-Metric Methods,2008,Oriental Journal of Chemistry,Journal article,0
1227,Dr Ravinder Singh,"AK Singh, S Singh, R Singh, RP Singh","Characteristics of drifting ELF/VLF emissions associated with substorms, observed at low latitude ground station Varanasi",2008,37th COSPAR Scientific Assembly,Journal article,0
1228,Dr Ravinder Singh,"RK Rajesh Kumar, R Singh, SS Sushil Sharma",Optimization of instantiation parameters for quick cooking of white chickpea.,2007,Undisclosed,Other,0
1229,Dr Ravinder Singh,"RK Rajesh Kumar, R Singh, SS Sushil Sharma",Development of quick cooking of desi chickpea.,2007,Undisclosed,Other,0
1230,Dr Ravinder Singh,"S Sihotra, K Singh, D Mehta, N Singh, J Goswamy, R Kumar, S Muralithar, ...",High spin states in {sup 129} Cs,2007,Undisclosed,Other,0
1231,Dr Ravinder Singh,"R Margolis, RP Singh, PK Kaiser",Intravitreal Bevacizumab Treatment of Retinal Pigment Epithelial Detachment Due to Age-Related Macular Degeneration,2007,Investigative Ophthalmology &Visual Science,Journal article,0
1232,Dr Ravinder Singh,"RP Singh, OFM Brasil, H Bando, PK Kaiser",Integrity of Scleral Closure After 23 Gauge and 25 Gauge Sutureless Vitrectomy,2007,Investigative Ophthalmology &Visual Science,Journal article,0
1233,Dr Ravinder Singh,"EX Fu, RP Singh, SD Smith, DR Williams, PK Kaiser",Predicative Factors for Visual and Anatomical Outcome After Intravitreal Bevacizumab Treatment of Neovascular Age-Related Macular Degeneration,2007,Investigative Ophthalmology &Visual Science,Journal article,0
1234,Dr Ravinder Singh,"R Kumar, R Singh, S Sharma",Optimization of instantiation parameters for quick cooking of white chickpea,2007,RESEARCH ON CROPS,Journal article,0
1235,Dr Ravinder Singh,"RP Singh, A Kumar, CP Singh","灌溉营养管理条件下印度芥菜在生长, 产量, 品质和营养吸收方面的反应",2007,第十二届国际油菜大会论文集,Other,0
1236,Dr Ravinder Singh,"SS Sanjay Srivastava, DP Ray, RP Singh",Chemical examination and antifungal activity of curry leaf (Murraya koenigii (L.) Spreng.).,2007,Undisclosed,Other,0
1237,Dr Ravinder Singh,"PS Puneet Srivastava, RP Singh, VK Tripathi",Response of gamma radiation (60Co) on vegetative and floral characters of gladiolus.,2007,Undisclosed,Other,0
1238,Dr Ravinder Singh,"V TRIPATHI, RP Singh",Diacylglycerol (DAG) oil: Nutritional relevance and metabolism,2007,Indian food industry,Journal article,0
1239,Dr Ravinder Singh,"S Srivastava, DP Ray, RP Singh",Chemical Examination and Antifungal Activity of Curry Leaf (Murraya koenigii (L.) Spreng.),2007,PESTICIDE RESEARCH JOURNAL,Journal article,0
1240,Dr Ravinder Singh,"AB Abidi, S Rahman, RP Singh","Important quality characteristics in the products prepared from rice varieties like lye, bhooja, chura and parboiled rice grown in Eastern Uttar Pradesh.",2007,Undisclosed,Other,0
1241,Dr Ravinder Singh,"R Singh, AS Sohi, KS Sangha",BIOLOGY OF ASPHADASTIS CRYPHOMYCHA MEYRICK (LEPIDOPTERA: PYRALIDAE) ON POPLAR IN PUNJAB,2007,INDIAN FORESTER,Journal article,0
1242,Dr Ravinder Singh,"RP Singh, AK Prasad",Enhanced level of water vapor during dust storms over the Indo-Gangetic basin,2006,"AGU Fall Meeting Abstracts 2006, A32C",Abstract,0
1243,Dr Ravinder Singh,"K Patel, AK Singh, RP Patel, RP Singh",Ionospheric Scintillations Induced by Sporadic-E Irregularities Over Low Latitude (P31),2006,2nd UN/NASA Workshop on International Heliophysical Year and Basic Space …,Conference paper,0
1244,Dr Ravinder Singh,"AK Sinha, RP Singh, NK Rana, BK Agarwal",P sorption in an acid alfisol-effect of cropping and nutrient use.,2006,Undisclosed,Other,0
1245,Dr Ravinder Singh,"R Singh, B Veenadhari, S Alex",Very Low Frequency (VLF) studies of Ionospheric/Magnetospheric Electromagnetic phenomena in Indian Low Latitude Region using AWESOME Receivers,2006,2nd UN/NASA Workshop on International Heliophysical Year and Basic Space …,Conference paper,0
1246,Dr Ravinder Singh,"RP Patel, S Singh, AK Singh, RP Singh",Role of Geomagnetic Disturbances on VLF Whistler Wave Activity at Low Latitudes (P32),2006,2nd UN/NASA Workshop on International Heliophysical Year and Basic Space …,Conference paper,0
1247,Dr Ravinder Singh,"VS Virender Sardana, RP Singh, SK Gupta",Differences in yield and quality of durum wheat (Triticum durum Desf) cultivars caused by nitrogen application.,2006,Undisclosed,Other,0
1248,Dr Ravinder Singh,"R Singh, SK Tripathi, S Kumar",Determination of the density of localized states in (Ge~ 2~ 0Se~ 8~ 0)~ 0~.~ 9~ 0Sn~ 0~.~ 1~ 0 glassy alloy,2006,Journal of optoelectronics and advanced materials,Journal article,0
1249,Dr Ravinder Singh,"V Kumar, P Thakur, AK Bhati, D Negi, RP Singh, RK Bhowmik",Nuclear g-factor measurements of the K {sup {pi}}= 5/2 {sup-} and 9/2 {sup-} isomers in {sup 169} Ta,2006,Undisclosed,Other,0
1250,Dr Ravinder Singh,RP Singh,Rural Infrastructure: A Micro Study of Agro-Climatic Sub-Zones of Bihar and Jharkhand,2006,Indian Journal of Agricultural Economics,Journal article,0
1251,Dr Ravinder Singh,"SK Garg, RP Singh, RK Gupta",Sustainable Integrated Fish-Cum-Live Stock And Poultry Farming,2006,Environment Conservation Journal 7 (1&2),Journal article,0
1252,Dr Ravinder Singh,"P Kumanthem, L Kumar, D Janga, R Hariprasad, R Patnaik, A Gupta, ...",Recurrent epithelial ovarian cancer (EOC): What determines the outcome?,2006,Journal of Clinical Oncology 24 (18_suppl),Journal article,0
1253,Dr Ravinder Singh,"R Singh, U Rai","Role of neuropeptide, 9-endorphin in control of innate immune responses in murrel, Channa punctatus",2006,JOURNAL OF EXPERIMENTAL ZOOLOGY PART A-ECOLOGICAL AND INTEGRATIVE PHYSIOLOGY …,Journal article,0
1254,Dr Ravinder Singh,"A Kumar, PB Saha, RP Singh, AK Sarkar",Profitability of Liming in Maize+ Pigeon Pea Intercropping System in Acid Soils,2006,JOURNAL OF RESEARCH-BIRSA AGRICULTURAL UNIVERSITY,Journal article,0
1255,Dr Ravinder Singh,"SR Sharma, R Singh",Pusa Sag 1: a new leafy mustard,2006,INDIAN HORTICULTURE,Journal article,0
1256,Dr Ravinder Singh,"AK Singh, RP Patel, K Patel, RP Singh",Study Of Ionospheric Irregularities Over Low-Latitude,2006,36th COSPAR Scientific Assembly,Journal article,0
1257,Dr Ravinder Singh,RP Singh,Technological developments in egg processing in India: future R &D needs.,2006,Undisclosed,Other,0
1258,Dr Ravinder Singh,"DR Satija, SK Gupta, RP Singh","Evaluation of wheat recombinant inbred lines in cross WL 711 x PH 132 for grain yield, quality and bread attributes",2006,Crop Improvement,Journal article,0
1259,Dr Ravinder Singh,"AK Singh, L Lalmani, RP Singh",Anomalous Propagation of VLF Waves at Low Latitudes,2006,36th COSPAR Scientific Assembly,Journal article,0
1260,Dr Ravinder Singh,"K Singh, RP Singh",Simulation of Dynamic Spectra of Transionospheric Pulse Pairs,2006,36th COSPAR Scientific Assembly,Journal article,0
1261,Dr Ravinder Singh,"V Sardana, RP Singh, SK Gupta",Differences in Yield and Quality of Durum Wheat (Triticum durum Desf) Cultivars caused by Nitrogen Application,2006,ENVIRONMENT AND ECOLOGY,Journal article,0
1262,Dr Ravinder Singh,"S Rahman, AB Abidi, RP Singh",Quality studies in products prepared from rice varieties,2006,Indian Journal of Agricultural Biochemistry,Journal article,0
1263,Dr Ravinder Singh,"RP Singh, SKS Chauhan",Driving excellence using six-sigma experience of Tata chemicals.,2006,Undisclosed,Other,0
1264,Dr Ravinder Singh,"S Roy, P Datta, S Chattopadhyay, S Bhattacharya, TK Ghosh, S Pal, ...",Prediction of magnetic bands in {sup 108} Ag through lifetime measurement,2005,Undisclosed,Other,0
1265,Dr Ravinder Singh,"TS Tara Shankar, RP Singh",Cultivation of aromatic and medicinal plants: a new era of rural development in New Bihar.,2005,Undisclosed,Other,0
1266,Dr Ravinder Singh,"TS Tara Shankar, RP Singh","Agriculture, productivity and cropping pattern in new Bihar: problems and prospects.",2005,Undisclosed,Other,0
