,Author,Authors,Title,Year,Source,Type,Cites
0,Dr Anupam Yadav,"N Yadav, A Yadav, M Kumar",An introduction to neural network methods for differential equations,2015,Undisclosed,Book,432
1,Dr Anupam Yadav,A Yadav,AEFA: Artificial electric field algorithm for global optimization,2019,Swarm and Evolutionary Computation,Journal article,367
2,Dr Anupam Yadav,"A Sadollah, H Sayyaadi, A Yadav",A dynamic metaheuristic optimization model inspired by biological nervous systems: Neural network algorithm,2018,Applied Soft Computing,Journal article,289
3,Dr Anupam Yadav,"A Yadav, N Kumar",Artificial electric field algorithm for engineering optimization problems,2020,Expert Systems with Applications,Journal article,110
4,Dr Anupam Yadav,"N Yadav, A Yadav, M Kumar, JH Kim",An efficient algorithm based on artificial neural networks and particle swarm optimization for solution of nonlinear Troesch’s problem,2017,Neural Computing and Applications,Journal article,59
5,Dr Anupam Yadav,"A Yadav, K Deep",An efficient co-swarm particle swarm optimization for non-linear constrained optimization,2014,Journal of Computational Science,Journal article,50
6,Dr Anupam Yadav,"D Chauhan, A Yadav, F Neri",A multi-agent optimization algorithm and its application to training multilayer perceptron models,2024,Evolving Systems,Journal article,47
7,Dr Anupam Yadav,A Yadav,Discrete artificial electric field algorithm for high-order graph matching,2020,Applied Soft Computing,Journal article,38
8,Dr Anupam Yadav,"D Chauhan, A Yadav",Optimizing the parameters of hybrid active power filters through a comprehensive and dynamic multi-swarm gravitational search algorithm,2023,Engineering Applications of Artificial Intelligence,Journal article,37
9,Dr Anupam Yadav,"A Yadav, K Deep, JH Kim, AK Nagar",Gravitational swarm optimizer for global optimization,2016,Swarm and Evolutionary Computation,Journal article,35
10,Dr Anupam Yadav,"N Yadav, A Yadav, M Kumar",History of neural networks,2015,An introduction to neural network methods for differential equations,Book chapter,35
11,Dr Anupam Yadav,"D Chauhan, A Yadav",An archive-based self-adaptive artificial electric field algorithm with orthogonal initialization for real-parameter optimization problems,2024,Applied Soft Computing,Journal article,32
12,Dr Anupam Yadav,A Yadav,An intelligent model for the detection of white blood cells using artificial intelligence,2021,Computer methods and programs in biomedicine,Journal article,29
13,Dr Anupam Yadav,"N Yadav, A Yadav, JH Kim",Numerical solution of unsteady advection dispersion equation arising in contaminant transport through porous media using neural networks,2016,Computers &Mathematics with Applications,Journal article,28
14,Dr Anupam Yadav,"A Yadav, K Deep",Constrained optimization using gravitational search algorithm,2013,National Academy Science Letters,Journal article,28
15,Dr Anupam Yadav,"D Chauhan, A Yadav",An adaptive artificial electric field algorithm for continuous optimization problems,2023,Expert Systems,Book chapter,27
16,Dr Anupam Yadav,"D Chauhan, A Yadav",A competitive and collaborative-based multilevel hierarchical artificial electric field algorithm for global optimization,2023,Information Sciences,Journal article,25
17,Dr Anupam Yadav,A Yadav,Comprehensive learning gravitational search algorithm for global optimization of multimodal functions,2019,Neural Computing and Applications,Book chapter,24
18,Dr Anupam Yadav,"D Chauhan, A Yadav","A Comprehensive Survey on Artificial Electric Field Algorithm: Theories and Applications: D. Chauhan, A. Yadav",2024,Archives of Computational Methods in Engineering,Journal article,23
19,Dr Anupam Yadav,"A Yadav, K Deep",Shrinking hypersphere based trajectory of particles in PSO,2013,Applied Mathematics and Computation,Journal article,19
20,Dr Anupam Yadav,"D Chauhan, A Yadav",Binary artificial electric field algorithm,2023,Evolutionary Intelligence,Journal article,18
21,Dr Anupam Yadav,"I Bala, A Yadav",Gravitational search algorithm: a state-of-the-art review,2018,Harmony Search and Nature Inspired Optimization Algorithms: Theory and …,Other,16
22,Dr Anupam Yadav,"N Yadav, A Yadav, JC Bansal, K Deep, JH Kim","Harmony Search and Nature Inspired Optimization Algorithms: Theory and Applications, ICHSA 2018",2018,Undisclosed,Book,15
23,Dr Anupam Yadav,"Anita, A Yadav, N Kumar",Application of artificial electric field algorithm for economic load dispatch problem,2019,International conference on soft computing and pattern recognition,Conference paper,13
24,Dr Anupam Yadav,"H Sayyaadi, A Sadollah, A Yadav, N Yadav",Stability and iterative convergence of water cycle algorithm for computationally expensive and combinatorial Internet shopping optimisation problems,2019,Journal of Experimental &Theoretical Artificial Intelligence,Journal article,13
25,Dr Anupam Yadav,"A Yadav, N Yadav, JH Kim",A study of harmony search algorithms: Exploration and convergence ability,2015,Harmony Search Algorithm: Proceedings of the 2nd International Conference on …,Conference paper,12
26,Dr Anupam Yadav,"D Chauhan, A Yadav",A crossover-based optimization algorithm for multilevel image segmentation,2023,Soft Computing,Book chapter,11
27,Dr Anupam Yadav,"D Chauhan, A Yadav",A hybrid of artificial electric field algorithm and differential evolution for continuous optimization problems,2022,"Proceedings of 7th International conference on harmony search, soft …",Conference paper,11
28,Dr Anupam Yadav,"N Yadav, A Yadav, M Kumar",Neural network methods for solving differential equations,2015,An Introduction to Neural Network Methods for Differential Equations,Book chapter,11
29,Dr Anupam Yadav,"D Khurana, A Yadav, A Sadollah",A non-dominated sorting based multi-objective neural network algorithm,2023,MethodsX,Journal article,10
30,Dr Anupam Yadav,"A Yadav, A Sadollah, N Yadav, JH Kim",Self-adaptive global mine blast algorithm for numerical optimization,2020,Neural Computing and Applications,Journal article,10
31,Dr Anupam Yadav,"K Deep, A Yadav, S Kumar",Improving local and regional earthquake locations using an advance inversion technique: Particle swarm optimization,2012,World Journal of Modelling and Simulation,Journal article,10
32,Dr Anupam Yadav,"A Sajwan, A Yadav",A study of exploratory and stability analysis of artificial electric field algorithm,2022,Applied Intelligence,Journal article,8
33,Dr Anupam Yadav,"I Bala, A Yadav",Niching comprehensive learning gravitational search algorithm for multimodal optimization problems,2022,Evolutionary Intelligence,Journal article,8
34,Dr Anupam Yadav,"N Yadav, A Yadav, K Deep",Artificial neural network technique for solution of nonlinear elliptic boundary value problems,2014,Proceedings of Fourth International Conference on Soft Computing for Problem …,Conference paper,8
35,Dr Anupam Yadav,"A Yadav, JH Kim",A niching co-swarm gravitational search algorithm for multi-modal optimization,2014,Proceedings of Fourth International Conference on Soft Computing for Problem …,Conference paper,8
36,Dr Anupam Yadav,"D Chauhan, B Dutta, I Bala, N van Stein, T Bäck, A Yadav","Evolutionary Computation and Large Language Models: A Survey of Methods, Synergies, and Applications",2025,arXiv preprint arXiv:2505.,Preprint,6
37,Dr Anupam Yadav,"I Bala, A Yadav, JH Kim",Optimization for cost-effective design of water distribution networks: a comprehensive learning approach,2024,Evolutionary Intelligence,Journal article,6
38,Dr Anupam Yadav,"S Pundir, A Yadav, S Das",Recent Trends in Communication and Intelligent Systems,2021,Undisclosed,Book,6
39,Dr Anupam Yadav,"Anita, A Yadav, N Kumar, JH Kim",Development of discrete artificial electric field algorithm for quadratic assignment problems,2020,International Conference on Harmony Search Algorithm,Conference paper,6
40,Dr Anupam Yadav,"D Chauhan, A Trivedi, A Yadav",U-AEFA: Online and offline learning-based unified artificial electric field algorithm for real parameter optimization,2024,Knowledge-Based Systems,Journal article,5
41,Dr Anupam Yadav,"D Chauhan, A Yadav",Stability and agent dynamics of artificial electric field algorithm,2024,The Journal of Supercomputing,Journal article,5
42,Dr Anupam Yadav,"H Sharma, M Saraswat, A Yadav, JH Kim, JC Bansal",Congress on Intelligent Systems,2020,Proceedings of CIS,Conference paper,5
43,Dr Anupam Yadav,"A Yadav, K Deep",A shrinking hypersphere PSO for engineering optimisation problems,2016,Journal of Experimental &Theoretical Artificial Intelligence 28 (1-2),Journal article,5
44,Dr Anupam Yadav,"N Yadav, A Yadav, M Kumar",Preliminaries of neural networks,2015,An introduction to neural network methods for differential equations,Book chapter,5
45,Dr Anupam Yadav,"D Chauhan, A Yadav",Performance of Artificial Electric Field Algorithm on 100 Digit Challenge Benchmark Problems (CEC-2019),2022,Proceedings of Academia-Industry Consortium for Data Science: AICDS,Conference paper,4
46,Dr Anupam Yadav,"Anita, A Yadav, N Kumar",Artificial electric field algorithm for solving real parameter CEC 2017 benchmark problems,2020,"Soft Computing for Problem Solving 2019: Proceedings of SocProS 2019, Volume …",Conference paper,4
47,Dr Anupam Yadav,"JH Kim, ZW Geem, D Jung, A Yadav","Advances in Harmony Search, Soft Computing and Applications",2020,Undisclosed,Book,4
48,Dr Anupam Yadav,"S Dhar, J Singh, P Singh, AK Yadav",Stability and bifurcation analysis of delayed neural network using harmonic balance approach,2019,2019 6th International Conference on Signal Processing and Integrated …,Conference paper,4
49,Dr Anupam Yadav,"A Tiwari, K Ahuja, A Yadav, JC Bansal, K Deep, AK Nagar",Soft Computing for Problem Solving,2020,Proceedings of SocProS,Conference paper,3
50,Dr Anupam Yadav,"A Yadav, Anita, JH Kim",Convergence of gravitational search algorithm on linear and quadratic functions,2018,Decision Science in Action: Theory and Applications of Modern Decision …,Other,3
51,Dr Anupam Yadav,"N Yadav, TT Ngo, A Yadav, JH Kim",Numerical solution of boundary value problems using artificial neural networks and harmony search,2017,International Conference on Harmony Search Algorithm,Conference paper,3
52,Dr Anupam Yadav,"A Yadav, K Deep",A novel co-swarm gravitational search algorithm for constrained optimization,2014,Proceedings of the Third International Conference on Soft Computing for …,Conference paper,3
53,Dr Anupam Yadav,"A Yadav, K Deep",A new disc based particle swarm optimization,2012,Proceedings of the International Conference on Soft Computing for Problem …,Conference paper,3
54,Dr Anupam Yadav,"N Gupta, I Bala, B Dutta, L Martínez, A Yadav",Enhancing explainability and reliable decision-making in particle swarm optimization through communication topologies,2025,Proceedings of the Genetic and Evolutionary Computation Conference Companion …,Conference paper,2
55,Dr Anupam Yadav,"D Chauhan, A Yadav, SB Cho",AEFA-FDB: A score-based artificial electric field algorithm for optimal reactive power dispatch problem with renewable and load demand uncertainties,2025,Applied Soft Computing,Journal article,2
56,Dr Anupam Yadav,"Anita, S Chamoli, A Yadav",An oppositional learning and chaotic local search-based artificial electric field algorithm for engineering optimization,2025,Evolutionary Intelligence,Journal article,2
57,Dr Anupam Yadav,"D Chauhan, A Yadav",Xor-based binary aefa: theoretical studies and applications,2022,2022 IEEE Symposium Series on Computational Intelligence (SSCI),Conference paper,2
58,Dr Anupam Yadav,"Q Xie, L Zhao, K Li, A Yadav, L Wang","Advances in Natural Computation, Fuzzy Systems and Knowledge Discovery: Proceedings of the ICNC-FSKD 2021",2022,Undisclosed,Book,2
59,Dr Anupam Yadav,"I Bala, A Yadav",Optimal reactive power dispatch using gravitational search algorithm to solve IEEE-14 bus system,2019,International Conference on Communication and Intelligent Systems,Conference paper,2
60,Dr Anupam Yadav,"A Yadav, N Yadav, JH Kim",A comparative study of exploration ability of harmony search algorithms,2017,International Conference on Harmony Search Algorithm,Conference paper,2
61,Dr Anupam Yadav,"D Chauhan, D Jung, A Yadav",Advancements in Multimodal Differential Evolution: A Comprehensive Review and Future Perspectives,2025,Artificial Intelligence Review,Journal article,1
62,Dr Anupam Yadav,"D Chauhan, A Yadav, R Mallipeddi",EAEFA-R: Multiple learning-based ensemble artificial electric field algorithm for global optimization,2025,Knowledge-Based Systems,Journal article,1
63,Dr Anupam Yadav,"A Yadav, S Chamoli",Machine Learning Applications of Evolutionary and Metaheuristic Algorithms,2024,Advanced Machine Learning with Evolutionary and Metaheuristic Techniques …,Other,1
64,Dr Anupam Yadav,A Yadav,"Proceedings of International Conference on Paradigms of Communication, Computing and Data Analytics: PCCDA 2023",2023,Undisclosed,Book,1
65,Dr Anupam Yadav,"I Bala, A Yadav",Optimizing Reactive Power of IEEE-14 Bus System Using Artificial Electric Field Algorithm,2022,Congress on Intelligent Systems,Conference paper,1
66,Dr Anupam Yadav,"M Dua, AK Jain, A Yadav, N Kumar, P Siarry","Proceedings of the International Conference on Paradigms of Communication, Computing and Data Sciences PCCDS 2021",2022,Undisclosed,Other,1
67,Dr Anupam Yadav,"SM Nigdeli, JH Kim, G Bekdaş, A Yadav","Proceedings of 6th International Conference on Harmony Search, Soft Computing and Applications ICHSA 2020, Istanbul",2020,Conference proceedings ICHSA,Conference paper,1
68,Dr Anupam Yadav,"N Yadav, JH Kim, A Yadav",Numerical solution of a class of singular boundary value problems arising in physiology based on neural networks,2016,Proceedings of Fifth International Conference on Soft Computing for Problem …,Conference paper,1
69,Dr Anupam Yadav,"A Yadav, K Deep, S Kumar",An Harmonic Potential Well Based Particle Swarm Optimization,2012,Journal of Information and Operations Management,Journal article,1
70,Dr Anupam Yadav,"S Kumar, R Sushil, A Kumar, VK Ray, P Ghosh, S Kumar, S Shikha, ...",Timely Prediction of Tsunami Using under Sea Earthquake Signals,2012,Proceedings of the International Conference on Soft Computing for Problem …,Conference paper,1
71,Dr Anupam Yadav,"D Chauhan, A Yadav",Binary AEFA for Solving Combinatorial,2025,Recent Trends in Communication and Intelligent Systems: Proceedings of …,Conference paper,0
72,Dr Anupam Yadav,"N Gupta, B Dutta, A Yadav",An Explainable Framework for Particle Swarm Optimization using Landscape Analysis and Machine Learning,2025,arXiv preprint arXiv:2509.,Preprint,0
73,Dr Anupam Yadav,"D Chauhan, N Gupta, A Yadav",An Explainable Reconfiguration-Based Optimization Algorithm for Industrial and Reliability-Redundancy Allocation Problems,2025,arXiv preprint arXiv:2504.,Preprint,0
74,Dr Anupam Yadav,"YD Banda, AK Yadav, M Kumar, SK Singh","Design and Analysis of a Defected Ground Structure T-Shaped Patch Antenna for IMT, WLAN, 5G, and 6G Applications",2024,MIKROTALASNA REVIJA,Journal article,0
75,Dr Anupam Yadav,"D Chauhan, A Yadav",An Ensemble of PSO and Artificial Electric Field Algorithm for Computationally Expensive Optimization Problems,2023,International conference on soft computing for problem-solving,Conference paper,0
76,Dr Anupam Yadav,"G Gupta, JH Kim, P Rana, A Yadav",Proceedings on International Conference on Data Analytics and Computing: ICDAC 2022,2023,Undisclosed,Book,0
77,Dr Anupam Yadav,"OP Verma, L Wang, R Kumar, A Yadav",Machine Intelligence for Research and Innovations,2023,Proceedings of MAiTRI,Conference paper,0
78,Dr Anupam Yadav,"A Yadav, P Rana, Anupam/Gupta Yadav (Gaura)",Proceedings on International Conference on Data Analytics and Computing,2023,Undisclosed,Other,0
79,Dr Anupam Yadav,"JH Kim, K Deep, ZW Geem, A Sadollah, A Yadav","Proceedings of 7th International Conference on Harmony Search, Soft Computing and Applications: ICHSA 2022",2022,Undisclosed,Book,0
80,Dr Anupam Yadav,"G Gupta, L Wang, A Yadav, P Rana, Z Wang",Proceedings of Academia-Industry Consortium for Data Science,2022,Undisclosed,Book,0
81,Dr Anupam Yadav,"AK Nagar, K Deep, JC Bansal, A Yadav, K Ahuja, A Tiwari","Soft Computing for Problem Solving: Proceedings of SocProS 2020, Volume 1",2021,Undisclosed,Book,0
82,Dr Anupam Yadav,"A Yadav, N Yadav, JH Kim, A Sadollah",Recent advances in soft computing and its applications,2019,Journal of Experimental &Theoretical Artificial Intelligence,Journal article,0
83,Dr Anupam Yadav,"A Yadav, K Deep, S Kumar",Metaheuristic Technique for Finding Earthquake Locations in N W Himalayan Region,2012,Advances in Geosciences,Journal article,0
84,Dr Anupam Yadav,"AN Mishra, VK Gupta, PK Shukla, AK Yadav",A Hybrid Approach For Automatic Face Detection In 3D And Grey Images,Unknown,Undisclosed,Other,0
85,Dr Anupam Yadav,"J Guglani, AN Mishra, VK Gupta, PK Shukla, AK Yadav",Transcription Variants Effects On The Continuous Punjabi Language ASR System,Unknown,Undisclosed,Other,0
86,Dr Anupam Yadav,"R Chaudhary, A Amit, A Yadav, A Singh, V Kumar, SK Singh, S Narayan, ...",Research Article Immunomodulation in Human Dendritic Cells Leads to Induction of Interferon-Gamma Production by Leishmania donovani Derived KMP-11 Antigen via Activation of NF …,Unknown,Undisclosed,Other,0
87,Dr Anupam Yadav,"AK Yadav, SK Singh, PK Shukla, A Nand, DVKG Mishra",Design And Parametric Analysis Of A CPW-Fed Patch Antenna For Very Low Frequency (VLF) Wireless Communication With Nuclear Submarines,Unknown,Undisclosed,Other,0
88,Dr Anupam Yadav,"A Yadav, SJ Nanda, MH Lim",PCCDA 2023,Unknown,Undisclosed,Other,0
89,Dr Anupam Yadav,"JH Kim, K Deep, ZW Geem, A Sadollah, A Yadav",ICHSA 2022,Unknown,Undisclosed,Other,0
90,Dr Damanjit Kaur,"R Sarwal, U Prasad, K Gopal, S Kalal, D Kaur, A Kumar, P Regy, ...",Investment opportunities in India's healthcare sector,2021,OSF,Other,78
91,Dr Damanjit Kaur,"JN Sharma, D Kaur",Rayleigh waves in rotating thermoelastic solids with voids,2010,Int. J. Appl. Math. Mech,Journal article,44
92,Dr Damanjit Kaur,"JN Sharma, D Grover, D Kaur",Mathematical modelling and analysis of bulk waves in rotating generalized thermoelastic media with voids,2011,Applied mathematical modelling,Journal article,32
93,Dr Damanjit Kaur,"PK Sharma, D Kaur, JN Sharma",Three-dimensional vibration analysis of a thermoelastic cylindrical panel with voids,2008,International Journal of Solids and Structures 45 (18-19),Journal article,29
94,Dr Damanjit Kaur,"JN Sharma, D Kaur",Modelling of circumferential waves in cylindrical thermoelastic plates with voids,2010,Applied mathematical modelling,Journal article,17
95,Dr Damanjit Kaur,"D Kaur, E Chou",Applying neuro-fuzzy techniques for intelligent highway pavement performance prediction model,1999,42nd Midwest Symposium on Circuits and Systems (Cat. No. 99CH36356),Conference paper,9
96,Dr Damanjit Kaur,"R Sarwal, U Prasad, KM Gopal, S Kalal, D Kaur, A Kumar","& Sharma, J.(2021)",Unknown,"Investment opportunities in India's healthcare sector,",Other,9
97,Dr Damanjit Kaur,"R Sarwal, U Prasad, K Madangopal, S Kalal, D Kaur, A Kumar, P Regy, ...",Investment opportunities in India’s healthcare sector. NITI Aayog. March 2021,2021,Accessed 20/12/,Journal article,6
98,Dr Damanjit Kaur,"JN Sharma, D Kaur",Generalized thermoelastic plane harmonic waves in materials with voids,2008,International journal of Applied Mechanics and Engineering,Journal article,6
99,Dr Damanjit Kaur,"P Lal, H Kaur, A Kumar","Information seeking behaviour: A case study of faculty members of social sciences, Panjab University, Chandigarh",2012,International Journal of Digital Library Services,Journal article,4
100,Dr Damanjit Kaur,D Kaur,A study of wave propagation in generalized thermoelastic materials with voids,2008,Ph. D,Other,2
101,Dr Damanjit Kaur,"D Kaur, B Ma",Microcontrolled music composition,1994,Proceedings of 1994 37th Midwest Symposium on Circuits and Systems,Conference paper,1
102,Dr Damanjit Kaur,"D Kaur, PJ Fernandes, LP Eugene, SC Kwatra",Hypercube-based architecture for high speed communication systems,1992,International journal of electronics,Journal article,1
103,Dr Damanjit Kaur,"D Kaur, JN Sharma",Plane Harmonic Waves in Generalized Thermoelastic Materials with Voids,2008,National Conference on Recent Advances in Innovative Materials (RAIM-08),Conference paper,0
104,Dr Damanjit Kaur,"D Kaur, J Sharma",A Simple Heuristic Approach for Branched Feeder Design in Planning of Radial Distribution Systems,2006,WSEAS TRANSACTIONS ON POWER SYSTEMS,Journal article,0
105,Dr Damanjit Kaur,"T Meitzler, G Gerhart, H Singh, S Bhama, Y Hamzeh, S Talahmeh, ...",Image Processing,1999,Undisclosed,Other,0
106,Dr Damanjit Kaur,"H Singh, A Sekhon, L Anneberg, E Yaprak, D Kaur",Multiple output terminal reliability for circuits,1996,Proceedings of the 39th Midwest Symposium on Circuits and Systems,Conference paper,0
107,Dr Damanjit Kaur,"D Kaur, T Drobnak",Microcontroller based talking thermometer,1993,Proceedings of 36th Midwest Symposium on Circuits and Systems,Conference paper,0
108,Dr Damanjit Kaur,"L Anneberg, D Kaur",Parallelism Resolution for Software Utilizing the Petri NetA'Matrix,1993,MODELING AND SIMULATION,Journal article,0
109,Dr Damanjit Kaur,"D Kaur, A Yaprak, AF Mahmood",Modelling of Image Processing Algorithms on Hypercube,1993,MODELING AND SIMULATION,Journal article,0
110,Dr Damanjit Kaur,"D Kaur, RB Sheelvant, AH Djoudi, MM Jamali",Householders Algorithm on Hypercube Architecture,1993,MODELING AND SIMULATION,Journal article,0
111,Dr Damanjit Kaur,"D Kaur, L Anneberg",The role of Petri net'A'matrix in determining switching protocols of hypercube connected networks,1992,TENCON'92-Technology Enabling Tomorrow,Book chapter,0
112,Dr Deepika Rani,"D Rani, TR Gulati, H Garg",Multi-objective non-linear programming problem in intuitionistic fuzzy environment: Optimistic and pessimistic view point,2016,Expert systems with applications,Journal article,90
113,Dr Deepika Rani,"D Rani, TR Gulati, A Kumar",A method for unbalanced transportation problems in fuzzy environment,2014,Sadhana,Journal article,52
114,Dr Deepika Rani,"KK Goyal, N Sharma, R Dev Gupta, G Singh, D Rani, HK Banga, R Kumar, ...",A soft computing-based analysis of cutting rate and recast layer thickness for AZ31 alloy on WEDM using RSM-MOPSO,2022,Materials,Journal article,48
115,Dr Deepika Rani,"D Rani, A Ebrahimnejad, G Gupta",Generalized techniques for solving intuitionistic fuzzy multi-objective non-linear optimization problems,2022,Expert Systems with Applications,Journal article,38
116,Dr Deepika Rani,"D Rani, TR Gulati",Uncertain multi-objective multi-product solid transportation problems,2016,Sādhanā,Journal article,33
117,Dr Deepika Rani,"KK Goyal, N Sharma, RD Gupta, S Gupta, D Rani, D Kumar, VS Sharma",Measurement of performance characteristics of WEDM while processing AZ31 Mg-alloy using Levy flight MOGWO for orthopedic application,2022,The International Journal of Advanced Manufacturing Technology 119 (11 …,Journal article,24
118,Dr Deepika Rani,"Shivani, D Rani, A Ebrahimnejad",An approach to solve an unbalanced fully rough multi-objective fixed-charge transportation problem,2022,Computational and Applied Mathematics,Journal article,21
119,Dr Deepika Rani,"D Rani, TR Gulati",A new approach to solve unbalanced transportation problems in imprecise environment,2014,Journal of Transportation Security,Journal article,21
120,Dr Deepika Rani,"D Rani, TR Gulati",Time optimization in totally uncertain transportation problems,2017,International Journal of Fuzzy Systems,Journal article,17
121,Dr Deepika Rani,"SK Singh, D Rani",A branching algorithm to solve binary problem in uncertain environment: an application in machine allocation problem,2019,OPSEARCH,Journal article,8
122,Dr Deepika Rani,"D Rani, TR Gulati",Application of intuitionistic fuzzy optimization technique in transportation models,2016,Opsearch,Journal article,7
123,Dr Deepika Rani,"D Rani, TR Gulati, A Kumar",On Fuzzy Multiobjective Multi‐Item Solid Transportation Problem,2015,Journal of Optimization,Journal article,7
124,Dr Deepika Rani,"G Gupta, D Rani, S Singh",An alternate for the initial basic feasible solution of category 1 uncertain transportation problems,2020,"Proceedings of the National Academy of Sciences, India Section A: Physical …",Journal article,5
125,Dr Deepika Rani,"D Rani, TR Gulati",Fuzzy optimal solution of interval-valued fuzzy transportation problems,2014,Proceedings of the Third International Conference on Soft Computing for …,Conference paper,4
126,Dr Deepika Rani,"G Gupta, S Singh, D Rani",A note on zero suffix method for the optimal solution of the transportation problems,2018,National Academy Science Letters,Journal article,2
127,Dr Deepika Rani,"AE Awdhesh Kumar Bind, Deepika Rani, Kapil Kumar Goyal",A solution approach for sustainable multi-objective multi-item 4D solid transportation problem involving triangular intuitionistic fuzzy parameters,Unknown,"Journal of Cleaner Production 414,",Journal article,0
128,Dr Jaspal Singh Aujla,"JS Aujla, FC Silva",Weak majorization inequalities and convex functions,2003,Linear Algebra and Its Applications,Journal article,201
129,Dr Jaspal Singh Aujla,"AJ Singh, HL Vasudeva",Inequalities involving Hadamard product and operator means,1995,Mathematica japonicae,Journal article,70
130,Dr Jaspal Singh Aujla,"JS Aujla, JC Bourin",Eigenvalue inequalities for convex and log-convex functions,2007,Linear algebra and its applications,Journal article,65
131,Dr Jaspal Singh Aujla,"R Pal, M Singh, MS Moslehian, JS Aujla",A new class of operator monotone functions via operator means,2016,Linear and Multilinear Algebra,Journal article,44
